id,paragraph,problems,question_plus,hint
generation-for-nlp-499,"신돈이 (가)을/를 설치할 것을 청하고 스스로 판사가 되어 전국에 방을 붙여 알리기를, “근래에 기 강이 크게 무너져서 탐욕을 부리는 것이 풍습이 되었다. …(중략)… 개경은 15일을 기한으로 하고, 여러 도는 40일을 기한으로 하여 스스로 잘못을 알고 고치는 자는 죄를 묻지 않을 것이나, 기한을 넘겨 일이 발각되는 자는 죄를 조사하여 다스릴 것이다. 망령되게 소송하는 자도 처벌하겠다.”라고 하였다.","{'question': '(가) 기구에 대한 설명으로 옳은 것은?', 'choices': ['임진왜란 이후 국정을 총괄하는 국가 최고 기구가 되었다 .', '임술 농민 봉기의 원인이었던 삼정의 문란을 바로잡기 위해 설치하였다 .', '일본 원정을 위해 설치하였으나 그 이후에도 존속하여 내정에 간섭하였다 .', '권문세족이 불법적으로 차지한 토지 문제 등을 해결하기 위해 설치하였다 .'], 'answer': 4}",,"신돈(辛惇, 1322~1371)은 고려 말기의 정치가이자 개혁가로, 몽골의 지배를 받던 시기에 태어나 조선 건국에 영향을 미쳤습니다. 그는 '원(元)'과의 관계 속에서 개혁을 추진하고, 부정부패를 척결하기 위한 기구, 즉 '사헌부(司憲府)'와 같은 연관된 기구를 제안했습니다. 지문에서 언급된 '기구'는 이러한 부패를 감시하고, 범죄를 처벌하기 위한 기관으로 해석될 수 있습니다. 신돈의 개혁 시도는 당시 고려 사회의 불만을 해소하려는 노력의 일환으로, 불법 행위에 대해 스스로 인식하고 시정할 기회를 주는 등의 내용이 포함되어 있습니다."
generation-for-nlp-500,제1조 대한민국은 민주공화제로 함…(중략) …민국 원년 3월 1일 우리 대한민족이 독립을 선언한 뒤 …(중략) …이 제 본 정부가 전 국민의 위임을 받아 조직되었으니 전 국민과 더불어 전심(專心)으로 힘을 모아 국토 광복의 대사명을 이룰 것을 선서한 다.,"{'question': '다음과 같은 선포문을 발표하면서 성립한 정부의 정책으로 옳지 않은 것은?', 'choices': ['독립 공채를 발행하였다 .', '기관지로 독립신문을 발간하였다 .', '비밀 행정 조직인 연통부를 설치하였다 .', '재정 확보를 위하여 전환국을 설립하였다 .'], 'answer': 4}",,"지문의 내용은 1919년 3·1 운동과 관련된 독립선언서를 모티브로 하고 있습니다. 이 운동은 한국의 독립을 위한 대규모 민족운동으로, 이후 수립된 대한민국 임시정부의 기초가 되었습니다. 임시정부는 민주공화제를 지향하며, 독립운동을 위한 다양한 정책과 외교 노력을 전개했습니다. 가장 중요했던 정책 중 하나는 ""독립군 양성""과 ""민족의 단결""이었고, 무장 투쟁과 외교 활동을 강조했습니다. 그러나 이들 정책은 종종 정권의 안정성 또는 압박 상황에 따라 변동되었습니다. 질문에서 옳지 않은 정부 정책을 찾기 위해서는 임시정부의 노선과 실제 실행된 정책의 일치 여부를 검토해야 합니다."
generation-for-nlp-501,"왕은 사벌주를 상주로 바꾸는 등 9주의 명칭을 개정하고, 군현의 이름도 한 자식으로 고쳤다. 또한, 중앙관서의 관직명도 중국의 예에 맞추어 한 자식으로 바꾸었다. －삼국사기－","{'question': '밑줄 친 ‘왕’의 재위 기간에 있었던 일로 옳은 것은?', 'choices': ['처음으로 정전이 지급되었다.', '독서 삼품과 가 시행되었다.', '녹읍이 부활되었다.', '국학이 설치되었다.'], 'answer': 3}",,"지문에 언급된 '왕'은 신라의 법흥왕(재위 514-540년)으로 추정됩니다. 법흥왕 때는 삼국 시대 신라가 중앙집권적 국가로 성장하는 과정이었으며, '사벌주'를 '상주'로 바꾸고 관직명을 정비하는 등 행정 조직을 정비했습니다. 이는 국가의 체제 강화를 위한 조치로, 중국의 제도를 참고하여 통치 기틀을 다지는 중요한 정책이었습니다. 이러한 변화는 국가의 통일적 관리체계 구축을 목표로 했습니다."
generation-for-nlp-502,"다음 글은 (가)의 부탁을 받고 (나)가 지은 것이다. 우리는 ‘외교’, ‘준비’ 등의 미련한 꿈을 버리고 민중 직접 혁명의 수단을 취함을 선언하노라. 조선 민족의 생존을 유지하자면 강도 일본을 쫓아내야 하고, 강도 일본을 쫓아내려면 오직 혁명으로써만 가능하니, 혁명이 아니고는 강도 일본을 쫓아낼 방법이 없는 바이다.","{'question': '(가)와 (나)에 대한 설명으로 옳은 것은?', 'choices': ['(가)는 조선 의용대를 결성하였고 , (나)는 ‘국혼’을 강조하였다 .', '(가)는 신흥 무관 학교를 세웠고 , (나)는 형평사를 창립하였다 .', '(가)는 조선 건국 동맹을 조직하였고 , (나)는 식민 사학의 한국사 정체성론을 반박하였다 .', '(가)는 황포 군관 학교에서 훈련 받았고 , (나)는 민족주의'], 'answer': 4}",,"이 지문은 한국의 독립운동과 관련된 문서로, (가)와 (나)는 각각 당시의 독립운동가와 저자일 가능성이 큽니다. (가)는 주로 '민중 혁명론'을 지지한 인물인 안중근일 수 있으며, (나)는 이념을 문서화한 인물로서 김광진 등이 될 수 있습니다. 이들은 일제 강점기(1910-1945)에 조선 민족의 생존을 위해 직접적인 혁명방법을 주장하며 저항의 필요성을 강조했습니다. 이 시기는 한일 합병 이후 강력한 제국주의 지배에 맞선 민족주의와 사회주의적 저항이 활발했던 시기입니다. 이러한 흐름은 나중에 3.1운동과 그에 이어진 혁명적 분위기로 이어졌습니다."
generation-for-nlp-505,(가)의 이봉창은 도쿄에서 일왕이 타고 가는 마차 행렬에 폭탄을 던졌다. 이 의거는 성공을 거두지는 못하였으나 일제에 큰 충격을 주었다.,"{'question': '(가) 단체에 속한 인물의 활동으로 옳은 것은?', 'choices': ['조명하가 타이 중에서 일본 육군 대장을 공격하였다 .', '안중근이 하얼빈에서 이 토 히로부미를 저격하였다 .', '장인환이 샌프란시스코에서 외교 고문 스티븐스를 저격하였다 .', '윤봉길이 상하이 훙커우 공원에서 열린 일제의 기념식장에 폭탄을 던졌다 .'], 'answer': 4}",,"이봉창은 한국 독립운동가로, 1932년 도쿄에서 일본 천황(일왕)의 마차 행렬에 폭탄을 던진 사건을 통해 세계에 한국의 독립 의지를 알리려 하였습니다. 이 사건은 ""이봉창 의거""로 알려져 있으며, 비록 실패했지만 일본제국에 큰 충격을 주고 한국 독립운동의 상징적인 사건으로 평가받습니다. 이봉창은 이후 일본에 의해 체포돼 사형당하며, 그의 용기는 많은 독립운동가들에게 영감을 주었습니다. 이봉창은 의열단과 같은 독립운동 단체에 소속되어 있었으며, 이들은 무장 투쟁을 통해 일본 제국의 통치에 저항했습니다."
generation-for-nlp-506,"왕은 자신을 ‘만천명월 주인 옹 (萬川明月主人翁 )’이라 칭하면서 모든 시냇물을 비추는 달처럼 모든 백성을 사랑하는 정치를 지향하였다. 또한, 화성을 건설하고 여러 차례 행차하여 왕의 위상을 과시하는 동시에 민생에 관한 백성들의 목소리를 직접 듣고자 하였다.","{'question': '밑줄 친 ‘왕’에 대한 설명으로 옳은 것은?', 'choices': ['청을 정벌하자는 북 벌운동을 추진하였다 .', '속대전을 편찬하여 통치제도를 정비하였다 .', '초계문신제를 실시하여 문신들을 재교육하였다 .', '명과 후금 사이에서 실리를 취하는 중립 외교를 펼쳤다 .'], 'answer': 3}",,"지문에 언급된 '왕'은 조선왕조 4대 임금인 세종대왕(1397-1450)으로 추정됩니다. 세종은 백성을 사랑하고 민생을 중시하는 정치 철학을 가지고 있었습니다. '만천명월 주인 옹'이라는 표현은 그가 백성을 자신의 자식처럼 사랑하며, 모든 시냇물에 비추는 달처럼 모든 이를 비추고 보호하겠다는 의지를 나타냅니다. 또한, 화성을 건설한 것은 서울의 방어를 강화하고 왕권을 상징하기 위한 조치였습니다. 그는 다양한 분야에서 혁신적인 업적을 남겨 한국 역사상 위대한 군주로 평가받고 있습니다."
generation-for-nlp-507,"이제 살펴보건대, 신라가 주․군을 설치할 때 그 전정(田丁), 호구(戶口)가 현의 규모가 되지 못하는 곳에는 ㉠, ㉡을/를 두어 소재지의 읍에 속하게 하였다. －신증동국 여지승람－지난 왕조 때 5도와 양계에 있던 역과 진에서 역을 부담한 사람과 ㉡의 사람은 모두 고려 태조 때의 명령을 거역한 사람이므로, 고려는 이들에게 천하고 힘든 일을 맡게 했다.－ 태조실록－","{'question': '㉠, ㉡의 거주민에 대한 설명으로 옳은 것은?', 'choices': ['실록청에서 사초 ․시정기․승정원일기 등을 바탕으로 실록을 편찬하였다.', '임진왜란 이전에 실록은 4부를 만들어 한양의 춘추관과 전주 ․성주 ․충주의 사고에 보관하였다.', '후대왕에게 본보기로 제공하고 자 국왕의 언행을 실록에서 가려 뽑아 국조보감을 편찬하였다.', '국왕과 대신 이 국정을 논의할 때 예문관 한림이사관으로 참가하여 시정기를 작성하였다.'], 'answer': 4}",,"지문에서 ㉠과 ㉡은 신라 및 고려 시대의 행정 단위와 관련된 용어로 보입니다. ㉠은 '리' 혹은 '동'으로, 작은 마을 단위를 의미하고, ㉡은 '촌'으로, 특정 행정 구역이나 세분화된 단위를 가리킬 수 있습니다. 신라가 읍의 규모에 따라 주․군을 설치할 때, 이러한 소규모 단위가 읍에 포함되어 관리되었습니다. 고려왕조 시절, 태조는 관리의 태도를 엄격하게 하여 특정 지역 거주민들에게 천한 노동을 부여하였고, 이는 왕조 명령을 불복종한 결과로 보입니다. 이러한 행정적 맥락은 한국 고대사에서 지역 통치 형태와 왕권 강화 과정의 일환으로 이해할 수 있습니다."
generation-for-nlp-508,(가) 정중부와 이의 방이정변을 일으켰다.(나) 최충헌이 이의민을 제거하고 권력을 잡았다.(다) 충주성에서 천민들이 몽골군에 맞서 싸웠다.(라)이자 겸 이척 준경과 더불어 난을 일으켰다.,"{'question': '다음 사건을 시기 순으로 바르게 나열한 것은?', 'choices': ['(가)→(나)→(라)→(다)', '(가)→(다)→(나)→(라)', '(라)→(가)→(나)→(다)', '(라)→(가)→(다)→(나)'], 'answer': 3}",,"정중부의 방이정변(1170년)은 고려시대에서 무신정권이 시작된 사건으로, 이후 최충헌이 이의민을 제거하고 권력을 장악하게 됩니다(최충헌은 1183년의 사건). 충주성에서 천민들이 몽골군에 저항한 사건은 1254년으로 나중의 일이죠. 이자겸과 이척 준경의 난은 1174년에 일어났습니다. 따라서 사건 순서는 다음과 같습니다: (가) → (라) → (나) → (다)입니다."
generation-for-nlp-510,"(진덕여왕 2년) 당 태종이 김춘추에게 (나에게) 할 말이 있는가 하기에 김춘추가 말하였다. “신의 나라는 바다 모퉁이에 치우쳐 있으면서도 천자의 조정을 섬긴 지 여러 해가 되었습니다. 그런데 백제는 강하고 교활하여 여러 번 침략을 해왔는데, 더구나 왕년에는 대대적으로 군사를 거느리고 깊이 쳐들어와 수십성을 함락했습니다.…(중략) … 만약 폐하께서 당나라 군사를 빌려주어 흉악한 것을 잘라 없애지 않는다면 우리나라 인민은 모두 포로가 될 것이며, 산 넘고 바다 건너 행하는 조회도 다시는 바랄 수 없을 것입니다.”라고 하였다. 태종이 매우 옳다고 여겨서 군사출동을 허락하였다. －삼국사기－","{'question': '다음 상황이 나타나게 된 역사적 배경으로 옳은 것은?', 'choices': ['(가) 사신인 서긍은 고려도경에서 고려청자의 우수함을 서술하였다.', '윤관은 별무반을 이끌어(가)를 몰아내고, 북방영토를 개척하였다.', '(가)가 빼앗긴 지역의 반환을 간청하자, 고려는 조공을 받는 조건으로 돌려주었다.', '(가)는 1115년 나라를 세운 뒤 고려에 군 신 관계를 요구하였다.'], 'answer': 2}",,"지문은 신라의 김춘추가 당나라의 태종에게 원군을 요청하는 장면입니다. 이 사건은 7세기 중반으로, 신라가 백제 및 고구려와의 전쟁에서 힘든 상황에 처해 있음을 보여줍니다. 특히 백제의 침략은 신라에 큰 위협이 되었고, 이로 인해 신라가 당나라와의 동맹을 모색하게 된 배경이 됩니다. 이 시기는 삼국 시대의 마지막 단계로, 신라가 당나라와의 협력으로 백제를 정복하고 후에 고구려와의 전쟁에서도 우세한 지위를 점하게 되는 중요한 전환점에 해당합니다."
generation-for-nlp-513,큰산과 깊은 골짜기가 많고 평원과 연못이 없다. 사람들이 계곡을 따라 사는데 골짜기물을 식수로 마셨다. 좋은 농경지가 없어서 부지런히 농사를 지어도 배를 채우기가 부족하다. 사람들의 성품은 흉악하고 급하며 노략질하기를 좋아하였다. －삼국지－,"{'question': '다음에 해당하는 나라에 대한 설명으로 옳은 것은?', 'choices': ['민 며느리제라는 독특한 혼인 풍습이 있었다.', '왕 아래에 가축의 이름을 딴마가, 우가, 저가 등의 관리가 있었다.', '10월에 제천행사를 성대하게 치르고, 국동대혈에 모여 제사를 지냈다.', '다른 부족의 생활권을 침범하면, 책화라 하여 노비와 소, 말로 변상하게 하였다.'], 'answer': 1}",,"지문은 고대 한국의 고구려 지역을 묘사한 것으로 보입니다. 고구려는 기원전 37년부터 기원후 668년까지 존재한 삼국 중 하나로, 한반도 북부와 중국 동북부를 포함한 넓은 영역을 차지했습니다. 자연환경이 험난하고 농경지가 부족했으며, 이로 인해 주민들은 생활이 어려웠고, 성격이 하드하고 전투적이었다고 알려져 있습니다. 고구려는 강력한 군사력과 정복 활동으로 유명하며, 특히 고대 중국과의 갈등과 전투가 많았습니다. 이러한 맥락 속에서, 지문의 내용은 고구려의 사회·경제적 특성을 잘 반영하고 있습니다."
