id,paragraph,problems,question_plus,hint
generation-for-nlp-473,"그가 왕에게 아뢰었다. “삼교는 솥의 발과 같아서 하나라도 없어서는 안 됩니다. 지금 유교와 불교는 모두 흥하는 데도교는 아직 번성하지 않으니, 소위 천하의 도술(道術)을 갖추었다고 할 수 없습니다.엎드려 청하오니 당에 사신을 보내도교를 구해와서 나라 사람들을 가르치게 하소서.”－삼국사기－","{'question': '밑줄 친 ‘그’에 대한 설명으로 옳은 것은?', 'choices': ['당나라와 동맹을 체결하였다.', '천리장성의 축조를 맡아 수행하였다.', '수나라의 군대를 살 수에서 격퇴하였다.', '남진 정책을 추진하여 한성을 점령하였다.'], 'answer': 2}",,"밑줄 친 '그'는 신라의 고위 관리인 '원효'로 추정됩니다. 원효는 7세기 중반 신라에서 활발히 활동한 불교 승려로, 유교와 불교, 도교의 조화로운 공존을 강조했습니다. 그는 '삼교일치' 사상을 주장하며, 서로 다른 세 가지 교리가 모두 어우러져야 한다고 보았습니다. 지문은 도교의 부흥을 요구하는 내용으로, 왕에게 도교의 교사 초빙을 청원하는 과정을 담고 있습니다. 이 시기는 신라의 불교가 정치적 지원을 받아 성장하던 시기로, 원효의 주장은 통일신라 사회에서 종교 간의 관계를 재조명하는 데 중추적이었습니다."
generation-for-nlp-475,일제의 침략이 거세지자 그는 국외로 망명했다. 그는 의열단장 김원봉의 요청을 받아 ‘조선혁명 선언’을 작성하였다. 이 선언에는 외교운동에 주력하자는 주장에 반대하고 더욱 적극적인 독립운동을 추진하자는 내용이 담겨 있다.,"{'question': '밑줄 친 ‘그’에 대한 설명으로 옳은 것은?', 'choices': ['민족주의 역사학을 지향한 독사 신론을 저술하였다.', '철저한 문헌고증을 지향하며 진단학회를 조직하였다.', '동학을 천도교로 개편하고 친일적인물들을 교단에서 내쫓았다.', '보편적 역사 발전법칙에 따라 역사를 기술한 조선사회경제사 를 집필하였다.'], 'answer': 1}",,"지문에서 언급된 '그'는 '이봉창'입니다. 그는 1919년 대한민국 임시정부의 독립운동가로 활동하며, 유학생 출신으로 일본의 재무장관을 암살 시도하는 등 과격한 독립운동을 펼쳤습니다. '조선혁명 선언'은 이러한 맥락에서 의열단장 김원봉의 요청으로 작성되었으며, 외교적 접근 대신 무장 독립운동의 필요성을 강조했습니다. 이 선언은 1923년 발표되었고, 항일운동의 방향성을 제시한 중요한 문서로 평가받습니다."
generation-for-nlp-476,"○평농서사 권신(權信)이 대상(大相) 준홍(俊弘)과 좌승(佐丞) 왕동(王同) 등이 반역을 꾀한다고 참 소하자 왕이 이들을 내 쫓았다. ○왕이 쌍기의 건의를 받아 처음으로 과거를 실시하였다. 시(詩) ․부(賦) ․송(頌) 및 시 무책을 시험하여 진사를 뽑았으며, 더불어 명 경업․의 업․복업 등도 뽑았다.","{'question': '밑줄 친 ‘왕’의 재위 기간에 있었던 일로 옳은 것은?', 'choices': ['노비안검법을 제정하였다 .', '전민변 정도감을 설치하였다 .', '토지제도로서 전시과를 시행하였다 .', '12목을 설치하고 지방관을 파견하였다 .'], 'answer': 1}",,"지문에 나타난 '왕'은 고려 성종(成宗)을 의미합니다. 성종은 981년부터 997년까지 재위했으며, 그의 통치 기간 동안 고려는 중앙집권적 체제를 강화하고 과거제를 도입하였습니다. 성종은 유교 국가 기반을 다지기 위해 과거 제도를 시행하여 인재를 선발하고, 권신인 권신과 왕동의 반역 음모를 척결하여 정부의 권위를 세웠습니다. 이 시기는 고려의 문화와 정치가 발전한 중요한 전환점으로 평가받습니다. 따라서 성종 재위 기간 중 과거 제도의 실시와 함께 정치적 안정이 중요한 사건으로 꼽힙니다."
generation-for-nlp-477,(가) 이종무가 대마도를 토벌하였다.(나) 김윤후가 용인에서 살리타를 사살하였다.(다) 김헌창이 공주를 근거로 반란을 일으켰다.(라) 이 시애가 길주에서 군사를 일으켰다.,"{'question': '다음의 사건을 시대 순으로 바르게 나열한 것은?', 'choices': ['(나)→(가)→(다)→(라)', '(나)→(다)→(라)→(가)', '(다)→(나)→(가)→(라)', '(다)→(나)→(라)→(가)'], 'answer': 3}",,"지문에 언급된 사건들은 고려시대의 주요 사건들로, 각각의 시대적 맥락은 다음과 같습니다. 1. **이종무의 대마도 토벌 (여몽 전쟁 당시)**: 1362년, 고려는 원나라의 군사적 위협에 맞서 대마도를 공격하여 정복했다. 이는 해상 세력 확립 목적의 일환이다. 2. **김윤후와 살리타의 전투 (1232)**: 김윤후는 몽골 침략 당시 용인에서 몽골 장수 살리타를 사살하며 고려의 저항을 상징적으로 나타낸 인물이다. 3. **김헌창의 반란 (822)**: 김헌창은 9세기 초 신라 말기의 환국 문제 부각으로 공주에서 반란을 일으켰다. 이는 지방 세력의 독립적 세력 확대를 의미한다. 4. **이 시애의 난 (1387)**: 이 시애는 고려 말 길주에서 군사를 일으켜 반란을 시도했다. 이들을 시대 순으로 나열하면: 김윤후 - 김헌창 - 이종무 - 이 시애가 된다."
generation-for-nlp-479,○항일민족교육의 요람인 서전 서숙을 설립하였다.○만국평화회의가 열린 헤이그에 특사로 파견되었다.,"{'question': '다음 설명에 해당하는 인물에 대한 설명으로 옳은 것은?', 'choices': ['경학사를 조직하였다.', '독립의 군부를 조직하였다.', '대한인 국민회를 조직하였다.', '대한광복 군 정부를 조직하였다.'], 'answer': 4}",,"지문에서 언급된 인물은 '신채호'입니다. 신채호는 한국의 독립운동가이자 역사학자로, 항일 민족 교육을 위해 서전 서숙을 설립했습니다. 서전 서숙은 1910년대 초 중국 상하이에 위치한 독립운동 교육 기관으로, 한국의 민족정신을 고취시키는 데 기여했습니다. 또한, 그는 1907년 헤이그 만국평화회의에 특사로 파견되어 일본의 식민지 정책을 국제사회에 알리려 했습니다. 그의 활동은 한국의 민족 자각과 독립운동의 뿌리를 다지는 데 중요한 역할을 했습니다."
generation-for-nlp-481,나라에서 재상을 선정할 때 뽑을 만한 사람 서너 명의 이름을 써서 상자에 넣고 봉해서 정사 암 위에 둔다. 얼마 뒤에 열어 보아 이름 위에 도장이 찍혀 있는 사람을 재상으로 삼았다.,"{'question': '다음과 같은 제도를 가진 국가에 대한 설명으로 옳은 것은?', 'choices': ['청소년의 조직인 화랑도를 두었다 .', '선종이 융성하여 9산 선문이 성립하였다 .', '삼국사기에 의하면 온조가 건국하였다고 한다.', '낙동강 하류 지역에 위치하여 해상 활동에 유리하였다 .'], 'answer': 3}",,"지문에 언급된 제도는 고려 시대의 '정사암'에서 시행된 '임명 제도'로, 특별한 투표 절차를 통해 재상을 선정했던 방식을 설명합니다. 고려는 10세기부터 14세기까지 존재한 왕국으로, 귀족 정치와 문신 중심의 관료 체계를 가졌습니다. 이 제도는 몽골 침략 등 어려운 상황에도 안정적인 정부 운영을 도모하기 위한 장치로 보입니다. 또한, 고려는 왕권과 귀족 세력 간의 균형을 유지하려고 했고, 이러한 방식은 공정성을 기하려는 노력의 일환으로 볼 수 있습니다."
generation-for-nlp-483,탑골공원에 모인 수많은 학생과 시민이 독립선언식을 거행하고 만세를 부르며 거리를 행진하였다. 이후 만세시위는 전국으로 확산하였다. 이 운동을 계기로 독립운동가 사이에는 독립운동을 더욱 조직적으로 전개하자는 공감대가 형성되어(가)가/이 만들어졌다. (가)는/은 구미 위원부를 설치하는 등 적극적으로 독립운동을 펼쳐나갔다.,"{'question': '(가) 단체의 활동에 대한 설명으로 옳은 것은?', 'choices': ['고종이 홍범 14조를 발표하였다.', '일본의 운요호가 초지진을 포격하였다.', '오페르트가 남연군의 묘도굴을 시도하였다.', '차별 대우에 불만을 품은 군인이 임오군란을 일으켰다.'], 'answer': 3}",,"(가) 단체는 **한족사회당**이나 **대한독립협회**를 지칭할 가능성이 높으며, 1919년 3.1운동 이후 독립운동가들은 독립을 위한 조직적인 활동을 강화했습니다. 특히, 구미 위원부는 미국 내에서 한국 독립을 위해 활동하는 대표적인 기관으로, 민족의 단결과 국제 사회에 독립 의지를 알리는 역할을 했습니다. 이들은 해외로의 독립운동 지원 요청, 외교 활동 등을 통해 독립을 위한 기반을 마련하고자 했습니다."
generation-for-nlp-484,1954년에 실시된 선거로 국회 내 다수 세력이 된 자유당은 새 개헌안을 국회에 상정하였다. 이 개헌안이 국회를 통과하기 위해서는 그 재적의원 203명의 3분의 2 이상이 찬성해야 했다. 그러나 표결 결과 135표를 얻는 데 그쳐 부결되었다. 그럼에도 자유당은 이른바 ‘사사오입’이라는 논리로 부결을 번복하고 가결을 선언하였다. 이는 절차적 민주주의 원칙이 크게 훼손된 사건이었다.,"{'question': '밑줄 친 ‘개헌안’에 대한 설명으로 옳은 것은?', 'choices': ['당시 재임 중인 대통령에 대해서는 중임제한 규정을 적용하지 않는다는 내용이 있었다.', '대통령 선거인단에 의 한 간접선거로 대통령을 선출한다는 조항을 두었다.', '국가보위비상대책위원회가 언론을 통제한다는 규정이 포함되어 있었다.', '대통령이 국회의원의 3분의 1을 직접 지명하도록 규정하였다.'], 'answer': 1}",,"1954년의 개헌안은 이승만 정권 하의 자유당이 제안한 것으로, 대통령 임기를 연장하고 권한을 강화하기 위한 목적을 가지고 있었습니다. 당시 재적의원 203명 중 3분의 2 이상의 찬성을 거쳐야 했으나, 표결에서 135표에 그쳐 부결되었습니다. 이에 자유당은 ‘사사오입’이라는 논리를 적용하여 부결된 결과를 뒤집고 가결로 선언했습니다. 이는 민주주의의 절차적 원칙을 침해한 중대한 사건으로, 이후 정치적 긴장과 권위주의적 통치 강화를 초래하게 되었습니다."
generation-for-nlp-486,일본군의 공세를 피해 만주와 러시아의 국경지대에 있는 밀산에 집결한 독립군 부대들은 서 일을 총재로 하는 (가)을/를 결성하였다.,"{'question': '(가)에 들어갈 군사 조직은?', 'choices': ['한국 광복군', '대한 광복회', '독립 의 군부', '대한 독립군단'], 'answer': 4}",,"(가)에 들어갈 군사 조직은 '대한독립군'입니다. 대한독립군은 1910년대 초 일본의 식민지 지배에 맞서 싸우기 위해 결성된 독립군으로, 서 일(서재필)은 이 조직의 지도자 중 한 명입니다. 이들은 일본군의 공세를 피하고 만주 및 러시아 국경 지역에서 독립운동을 활발히 전개했습니다. 대한독립군은 의병과 더불어 한국 독립운동의 중요한 축을 이루었으며, 후에 서로군정서 등 여러 독립군과 연합해 싸움의 강도를 높였습니다."
generation-for-nlp-487,"16년 겨울 10월, 왕이 질양(質陽)으로 사냥을 갔다가 길에 앉아 우는 자를 보았다. 왕이 말하기를 “아! 내가 백성의 부모가 되어 백성들이 이 지경에 이르게 하였으니 나의 죄로 다.” …(중략) …그리고 관리들에게 명하여 매년 봄 3월부터 가을 7월까지 관청의 곡식을 내어 백성들의 식구 수에 따라 차 등 있게 빌려주었다가, 10월에 이르러 상환하게 하는 것을 법규로 정하였다.－삼국사기－","{'question': '밑줄 친 ‘왕’에 대한 설명으로 옳은 것은?', 'choices': ['낙랑군을 축출하였다 .', '진대법 을 시행하였다 .', '백제의 침입으로 전사하였다 .', '영락이라는 독자적인 연호를 사용하였다 .'], 'answer': 2}",,"지문에서 언급된 '왕'은 신라의 제30대 왕인 진흥왕(진흥왕 501-576)으로 추정됩니다. 진흥왕은 신라의 영토를 확장하고 왕권을 강화한 왕으로, 특히 고구려와 가야를 포함한 주변 국가들과의 전투에서 많은 성과를 거두었습니다. 그는 백성을 부모처럼 여기며 정책적으로 농민을 보호하고 경제적 지원을 제공하는 등의 노력을 하였습니다. 지문의 내용은 진흥왕이 사회적 불평등에 대한 반성과 함께 백성을 위한 복지 정책을 시행했다는 것을 보여줍니다. 이러한 정책은 왕의 도덕적 책임을 강조하고 국가의 안정을 위한 중요한 조치로 평가받습니다."
generation-for-nlp-488,"○왕이수(隋)에 군사를 청하는 글을 요청하자, ㉠은/는 “자기가 살기 위해 남을 멸망시키는 것은 승려가 할 일이 아니나, 제가 대왕의 땅에 살면서 수초(水草)를 먹고 있사 오니 명령을 따르겠습니다.”라고 하였다. ○왕이 왕성을 짓고자 하여 ㉡에게 의견을 묻자, “비록 들판의 초가집에 살아도 바른 도를 행하면 복업이 길어질 것이요, 그렇지 않으면 사람을 수고롭게 하여 애써 성(城)을 만들지라도 역시 이익이 없을 것입니다.”라고 하였다. －삼국사기－","{'question': '㉠, ㉡ 승려의 활동으로 옳은 것은?', 'choices': ['㉠－왕에게 건의하여 황룡사 9층 탑을 세웠다.', '㉠－화랑이 지켜야 할 세속오계를 만들었다.', '㉡－ 저잣거리에서 무애가 를 부르면서 대중을 교화하였다.', '㉡－ 당에 유학하여 유식론을 독자적으로 발전시켰다.'], 'answer': 2}",,"지문에서 언급된 ㉠과 ㉡은 신라의 승려인 ""원효""와 ""의상""으로 알려집니다. 원효는 8세기 초 신라에서 불교 사상을 대중화하고 '화엄사상'을 발전시킨 인물로, 그의 활동은 민중에게 불교를 쉽게 이해시키는 데 큰 기여를 했습니다. 의상은 7세기에 활동하며 선종의 기초를 다졌고, 불교의 실천적인 면을 강조했습니다. 두 승려 모두 신라의 정치적, 사회적 혼란 속에서 불교의 가치와 도덕적 실천을 강조하며 국가의 안정을 도모했습니다. 이들의 생각은 단순한 물질적 성취보다 도덕적 가치와 내적 수양의 중요성을 강하게 표현하고 있습니다."
generation-for-nlp-490,"제1조 회사의 설립은 조선 총독의 허가를 받아야 한다. 제5조 회사가 본령이나 본령에 따라 나오는 명령과 허가 조건을 위반하거나 공공질서와 선량한 풍속에 반하는 행위를 할 때 조선 총독은 사업의 정지, 지점의 폐쇄, 또는 회사의 해산을 명할 수 있다.","{'question': '다음 법령이 시행된 시기에 있었던 사실로 옳은 것은?', 'choices': ['산미 증식 계획이 폐지 되었다 .', '국가 총동원법 이 제정되었다 .', '원료 확보를 위한 남면 북양 정책이 추진되었다 .', '보통 학교 수업 연한을 4년으로 정한 조선 교육령 이 공포되었다 .'], 'answer': 4}",,"지문은 조선총독부 시대의 법령으로 보이며, 이는 1910년부터 1945년까지의 식민지 시기에 해당합니다. 이 시기 조선은 일본의 식민 통치 아래 있었으며, 모든 회사의 설립과 운영은 조선 총독의 허가를 받아야 했습니다. 이는 일본이 조선 내 경제적 통제를 강화하고, 반일 운동과 같은 저항을 억압하기 위한 법적 장치였습니다. 1930년대의 경제적 어려움과 민족운동의 확산과 함께 이러한 법령은 총독부의 지배를 더욱 견고히 하는 역할을 했습니다."
generation-for-nlp-491,"왕이 복주에 이르렀다.정세운은 성품이 충성스럽고 청렴하였는데, 왕의 파천(播遷) 이래 밤낮으로 근심하고 분하게 여겨서 홍건적을 물리치고 개경을 회복하는 것을 자신의 임무로 여겼다.…(중략) … 마침내 정세운을 총병관으로 임명하였다.－고려사절요－","{'question': '밑줄 친 ‘왕’의 재위 기간에 있었던 일로 옳은 것은?', 'choices': ['이제현에 의해 사략이 편찬되었다.', '직지 심체요절이 금속활자로 인쇄되었다.', '정치도 감이 설치되었다.', '향약구급방이 편찬되었다.'], 'answer': 1}",,"지문에서 언급된 '왕'은 고려의 충숙왕(재위 1313-1332)으로 보이며, 그의 재위 기간 동안 홍건적의 침입과 고려의 방어 노력이 있었습니다. 홍건적은 14세기 초 중국에서 발생한 반란 세력으로, 고려에 대한 공격을 강화했습니다. 정세운은 용맹스러운 장수로, 왕의 파천과 개경 회복을 위해 중요한 역할을 하는 인물이었습니다. 그의 총병관 임명은 이러한 배경 속에서 고려의 재건을 위한 군사적 노력을 강화하기 위한 조치로 해석할 수 있습니다."
generation-for-nlp-492,"왕의 어릴 때 이름은 모니노이며, 신 돈의 여 종 반야의 소생이었다. 어떤 사람은 “반야가 낳은 아이가 죽어서 다른 아이를 훔쳐서 길렀는데, 공민왕이 자신의 아들이라고 칭하였다.”라고 하였다. 왕은 공민왕이 죽은 뒤 이인 임의 추대로 왕위에 올랐다. 이후 이인 임, 염흥방, 임견미 등이 권 력을 잡아 극심하게 횡포를 부렸다.","{'question': '밑줄 친 ‘왕’의 재위 기간에 있었던 일로 옳은 것은?', 'choices': ['이종무가 왜구의 소굴인 대마도를 정벌하였다 .', '삼별초가 반란을 일으켜 대몽 항쟁을 계속하였다 .', '쌍성총관부를 공격해 철령 이북 지역을 수복하였 다.', '요동 정벌을 위해 출병한 이성계가 위화도에서 회군하였다 .'], 'answer': 4}",,"지문에서 언급된 '왕'은 고려시대의 공민왕입니다. 그의 본명은 이성계이며, 그는 그가 왕위에 오를 당시 혼란한 정치 상황을 겪었습니다. 공민왕(재위 1351-1374)은 고려의 마지막 황금기를 지배한 인물로, 몽골 태조 시기에 태어났습니다. 그는 유교적 정치 체제를 강화하고, 권신들의 횡포를 막으려 했습니다. 그러나 그의 사후 이인 임 등의 권신들로 인해 고려 말 정치적 혼란이 가중되었으며, 이는 후에 조선 건국으로 이어지는 배경이 됩니다. 공민왕의 정치는 왕권 강화를 시도했지만, 권신들의 치세와 타락으로 번민의 시기로, 고려 말기의 불안정한 정치상을 반영합니다."
generation-for-nlp-493,"북쪽 구지에서 이상한 소리로 부르는 것이 있었다.…(중략) … 구간(九干)들은 이 말을 따라 모두 기뻐하면서 노래하고 춤을 추었다. 자줏빛줄이 하늘에서 드리워져서 땅에 닿았다. 그 줄이 내려온 곳을 따라가 붉은 보자기에 싸인 금으로 만든 상자를 발견하고 열어보니, 해처럼 둥근 황금알 여섯 개가 있었다. 알여섯이 모두 변하여 어린 아이가 되었다.…(중략) … 가장 큰 알에서 태어난 수로(首露)가 왕위에 올라(가)를/ 을 세웠다.－삼국유사－","{'question': '(가) 나라에 대한 설명으로 옳은 것은?', 'choices': ['해상교역을 통해 우수한 철을 수출하였다.', '박, 석, 김씨가 교대로 왕위를 계승하였다.', '경당을 설치하여 학문과 무예를 가르쳤다.', '정사암회의를 통해 재상을 선발하였다.'], 'answer': 1}",,"지문은 ""삼국유사""에서 인용된 것으로, 이는 한국의 고대 역사와 신화를 기록한 책입니다. 여기서 등장하는 수로(首露)는 한국의 신라를 건국한 초대 왕으로, 전설에 따르면 하늘에서 내려온 황금알에서 태어났습니다. 이는 신라의 건국 신화로, 신라가 하늘의 자손으로서의 정통성을 강조하는 내용을 담고 있습니다. 신라는 기원전 57년에 건국되어 이후 삼국시대의 중심세력으로 성장하였으며, 문화와 정치에서 많은 업적을 남긴 나라입니다. 이에 따라 신라에 대한 설명으로 옳은 것은 신화적 기원을 바탕으로 한 국가의 정당성을 나타낸다는 점입니다."
generation-for-nlp-494,"(가)는/은 북학의를 저술하여 청의 선진기술을 적극적으로 수용할 것과 상공업 육성 등을 역설하였다. 한편, (나)는/은 중국 및 일본의 방대한 자료를 참고하여 해동역사를 편찬함으로써, 한 ․중․일간의 문화교류를 잘 보여주었다.","{'question': '(가), (나)에 들어갈 이름을 바르게 연결한 것은?', 'choices': ['박지원 한치윤', '박지원 안정복', '박제가 한치윤', '박제가 안정복 '], 'answer': 3}",,"(가)에 해당하는 인물은 '박지원'입니다. 그는 18세기 후반에 활발히 활동한 실학자로, 『북학의』를 저술하여 청나라의 선진 기술을 도입하고 상공업을 발전시킬 것을 강조했습니다. 반면, (나)에 해당하는 인물은 '이긍익'입니다. 그는 『해동역사』를 편찬하여 고려와 조선, 그리고 중국과 일본 간의 문화적 교류와 역사를 정리했습니다. 이 두 인물은 각각 한국의 실학과 근대화, 그리고 동아시아 역사 연구에 기여한 중요한 인물입니다."
generation-for-nlp-496,"일본 정부는 그 대표자로 한국 황제 밑에 1명의 통감을 두되, 통감은 전적으로 외교에 관한 사항을 관리하기 위하여 경성에 주재하고 친히 한국 황제를 만날 수 있는 권리를 가진다. 또한, 일본 정부는 한국의 개항장 및 일본 정부가 필요하다고 인정하는 지역에 이사관을 설치할 권리를 가지며, 이사관은 통감의 지휘 하에 종래 재(在)한국 일본영사에게 속하였던 모든 권리를 집행한다.","{'question': '다음과 같은 내용이 담긴 조약에 대한 설명으로 옳은 것은?', 'choices': ['조선총독부를 설치한다는 조항이 포함되어 있다.', '헤이그 특사 사건 직후 일제의 강요로 체결되었다.', '방곡령 시행 전에 미리 통보해야 한다는 합의가 실려 있다.', '일본의 중재 없이 국제적 성격을 가진 조약을 체결할 수 없다는 내용이 담겨 있다.'], 'answer': 4}",,"지문의 내용은 1905년 일본과 대한제국 간 체결된 을사조약을 설명하고 있습니다. 을사조약은 일본이 대한제국의 외교권을 박탈하고, 통감(일본의 외교 대표)을 설치하여 실질적으로 대한제국을 지배하게 된 사건입니다. 이 조약은 한국의 독립성과 주권을 침해하여 한일 관계의 갈등을 심화시켰으며, 이후 일제강점기로 이어지는 계기가 되었습니다. 한국인들은 이 조약의 부당함을 저항했고, 이는 이후의 독립운동으로 이어졌습니다."
generation-for-nlp-498,(가)농민군이 정부와 전주화약을 맺었다. (나) 농민군이 우금치에서 전투를 벌였다. (다) 농민군이 황토현에서 관군을 물리쳤다. (라) 전봉준 등이 농민을 모아 고부 관아를 습격하였다.,"{'question': '이를 시기 순으로 바르게 나열한 것은?', 'choices': ['국가에서 저화를 만들어 유통하였다 .', '강경포 , 원산포 등의 포구들이 상업의 중심지로 성장하였다 .', '객주나 여각은 상품 매매를 중개하고 , 운송ᆞ보관ᆞ숙박 등의 영업도 하였다 .', '국가가 동전을 대량으로 발행하지만 유통화폐가 부족해지는 전황이 일어나기도 하였다 .'], 'answer': 1}",,"위 지문은 1894년 동학농민운동과 관련된 사건들을 다루고 있습니다. 1. (라) 전봉준 등의 고부 관아 습격: 동학농민운동의 시작으로, 1894년 3월 발생했습니다. 농민들은 이 사건을 통해 자신의 권리를 주장하였습니다. 2. (가) 전주화약 체결: 1894년 4월, 농민군과 정부 간의 협정을 통해 전라북도 전주에서 전투를 소강상태로 이끌었습니다. 3. (다) 황토현 전투: 1894년 5월에 발생한 사건으로, 농민군이 관군을 크게 무찌른 전투입니다. 4. (나) 우금치 전투: 1894년 11월 발생한 마지막 전투로, 농민군의 패배로 동학농민운동이 사실상 종결되었습니다. 따라서 올바른 순서는 (라) → (가) → (다) → (나)입니다."
