id,paragraph,problems,question_plus,hint
generation-for-nlp-662,대체출산이 달성된 지 오래된 후에도 인구가 오랫동안 계속해서 증가하는 경향은...,"{'question': '대체출산이 달성된 지 오래된 후에도 인구가 오랫동안 계속해서 증가하는 경향은?', 'choices': ['영의 인구 증가', '고성장 속도', '항상성 고원', '인구학적 모멘텀'], 'answer': 4}",,"대체출산률이란 인구가 유지되기 위해 필요한 출산율로, 보통 2.1명으로 여겨집니다. 한국은 2000년대 초반부터 대체출산율 이하로 떨어졌으나, 인구는 여전히 증가하는 경향을 보여왔습니다. 이는 인구 고령화와 긴 생명 expectancy로 인한 자연적 감소보다 이주나 기타 요인들에 의해 증가할 수 있습니다. 한국의 높은 경제 성장과 도시화는 인구 집중을 초래하며, 이는 대도시의 인구 밀집 현상 및 문화적 다양성을 증가시킵니다. 환경 문제는 경제 성장과 밀접하게 연결되어 있으며, 대기오염과 같은 문제들이 인구 건강에 영향을 미칠 수 있습니다."
generation-for-nlp-663,거리가 멀어짐에 따라 이동이 감소하는 경향은...,"{'question': '거리가 멀어짐에 따라 이동이 감소하는 경향은?', 'choices': ['유출 요인', '유인 요인', '거리 감쇠', '이수 선택성'], 'answer': 3}",,"거리가 멀어짐에 따라 이동이 감소하는 경향은 '거리 감소 법칙'으로 설명됩니다. 이는 지리적 요인에서 기인하며, 일반적으로 이동 시간 및 비용이 증가함에 따라 사람들의 이동 빈도가 줄어드는 현상을 나타냅니다. 예를 들어, 도시와 농촌 간 이동, 또는 관광지 방문 시 거리 증가에 따라 관심도와 방문 수가 감소하게 됩니다. 기후, 인구 밀도, 그리고 경제 활동도 이 경향에 영향을 미치며, 예를 들어 대도시는 인구 집중으로 이동이 더 활발하지만, 외곽 지역은 상대적으로 덜 활성화됩니다. 이러한 지리적 요인은 계획 및 정책 수립 시 중요하게 고려됩니다."
generation-for-nlp-664,다국적 기업은 운영을 분산하여...,"{'question': '다국적 기업의 운영 방식에 대한 설명으로 옳은 것은?', 'choices': ['생산비용이 가장 높은 제품을 제조한다', '경제적인 곳에서 회계 및 연구 서비스를 수행한다', '비교우위를 바탕으로 한다', '본사는 저개발국에 소재한다'], 'answer': 3}",,"지문은 다국적 기업의 운영 방식을 언급하며, 관련된 지리적 맥락으로는 지역적 특성이 중요한 역할을 합니다. 예를 들어, 다국적 기업은 비용 절감을 위해 인건비가 저렴한 아시아 국가나 생산 인프라가 좋은 국가에 공장을 두는 경향이 있습니다. 또한, 기후와 자원 분포도 고려되어, 특정 지역에서 원자재를 적극적으로 활용할 수 있습니다. 인구 밀도가 높은 도시 지역은 소비 시장으로서 가치가 커지므로, 마케팅 전략 수립에 중요한 요소로 작용합니다. 전 세계적으로 물류와 통신의 발달로 인해 기업의 글로벌 운영이 용이해졌으며, 이는 환경 문제나 규제에 대한 대응을 요구하기도 합니다."
generation-for-nlp-666,해안이 있는 모든 국가에는 UN 해양법협약에 근거한 배타적 경제수역(EEZ)이 있다.,"{'question': '해양법과 EEZ에 관한 다음 설명 중 옳지 않은 것은?', 'choices': ['EEZ는 해안선에서 최대 200해리(370km)까지 확장된다', '국가는 EEZ 내 천연자원을 이용할 권리가 있다', '국가는 EEZ를 넘어 최대 350해리(560km)까지 확장되는 대륙붕 자원을 활용할 수 있다', '국가는 EEZ 내 생물자원을 이용할 권리가 없다'], 'answer': 4}",,"배타적 경제수역(EEZ)은 해안으로부터 최대 200해리까지의 해양 공간에서 국가가 자원 개발 및 관리에 대한 권리를 가지는 구역으로, 유엔 해양법 협약(UNCLOS)에 의해 규정됩니다. EEZ 내에서는 어업, 해저 자원 채굴, 해양 연구 등이 가능하며, 해당 국가가 생물자원과 비생물자원에 대한 경제적 권리를 행사할 수 있습니다. 해양법은 국제적 분쟁 방지를 목표로 하며, 해양 환경 보호와 지속 가능한 개발도 중요합니다. 그러나 EEZ는 국가의 소속 여부와 상관없이 국제 수역의 관할권과는 다릅니다. 이러한 맥락에서 EEZ와 관련된 규정이 잘못 이해되기 쉬우므로 주의가 필요합니다."
generation-for-nlp-667,인도 바라나시(베나레스)와 사우디아라비아의 메카가 비슷한 도시인 이유는...,"{'question': '인도 바라나시(베나레스)와 사우디아라비아의 메카가 비슷한 도시인 이유는?', 'choices': ['구 영국 식민지였던 국가의 수도', '수많은 순례자의 목적지', '세계 경제의 상당 부분을 위한 금융 중심지', '현대 도시계획의 예'], 'answer': 2}",,"인도 바라나시와 사우디아라비아 메카는 각각 힌두교와 이슬람교의 성지로, 종교적 중요성에서 공통점을 가집니다. 바라나시는 갠지스 강가에 위치해 식수와 종교 의식에 필수적이며, 매년 수많은 순례자와 관광객을 유치합니다. 메카는 카바가 있는 무슬림의 성지로, 매년 하지를 위해 대규모 인파가 모입니다. 두 도시는 고유의 풍부한 문화와 전통을 지니며, 경제적으로 종교 관광에 크게 의존합니다. 이러한 요소들은 두 도시를 서로 유사하게 만드는 주요 요인입니다."
generation-for-nlp-668,랄프는 같은 제품을 구입하고자 이웃 소도시까지 50마일을 운전하지 않고 근처 정원용품 상점에서 정원용 비료를 구입한다.,"{'question': '어떤 유형의 공간적 상호작용을 반영하는가?', 'choices': ['이동성', '상보성', '개입 기회', '영토성'], 'answer': 3}",,"이 지문은 '근접성'의 중요성을 반영하는 공간적 상호작용을 나타냅니다. 랄프는 가까운 정원용품 상점을 선택함으로써 시간과 비용을 절감하려는 의도를 보여줍니다. 이는 경제적 행위로서, 소비자들이 지역 내에서 자원을 찾고 이동 거리를 최소화하려는 경향을 반영합니다. 지역 경제의 활성화, 상점 간 경쟁성 및 지역 사회의 연결성을 강조하며, 이러한 상호작용은 인구 밀도가 높은 도시 지역에서 더욱 두드러질 수 있습니다. 특히 소도시 환경에서는 대형 소매점과의 경쟁이 두드러지며, 지역 상점의 생존을 위한 전략으로 나타납니다."
generation-for-nlp-670,"가이아나, 수리남, 프랑스령 기아나의 공식 언어는 각각 영어, 네덜란드어, 프랑스어다.","{'question': '이들 국가는 어느 대륙에 있는가?', 'choices': ['북아메리카', '남아메리카', '아프리카', '아시아'], 'answer': 2}",,"가이아나, 수리남, 프랑스령 기아나는 남아메리카에 위치한 국가들입니다. 이들은 아마존 열대 우림의 일부로, 풍부한 생물 다양성을 자랑하며 열대 기후의 영향을 받습니다. 주로 원주율적인 농업, 광업과 같은 경제 활동이 이루어지며, 기후 변화와 개발로 인한 환경 문제도 발생하고 있습니다. 또한, 이 지역은 다문화 사회로 인류의 역사가 다양하게 얽혀 있습니다."
