id,paragraph,problems,question_plus,hint
generation-for-nlp-1318_aug,"“3년 동안 우리 나라를 노예화하려고 애쓰던 외적과의 대치하는 시기, 하나님께서는 기뻐하시며 러시아에게 더욱 고통스러운 시련을 내려주셨다. 바로 이 완고한 전쟁의 진전에 있어 치명적인 영향을 미칠 위험이 있는 내부 문제였다. 러시아의 운명, 영웅적인 군대의 명예, 인민의 행복, 사랑하는 조국의 전체적인 미래를 위해서는 전쟁에서의 승리를 위한 그 어떤 대가라도 치러야만 한다. 우리의 잔혹한 적들은 마지막 결전을 준비하고 있으며, 우리의 용감한 군대가 영광스러운 동맹국과 협력하여 마침내 적을 전복시킬 순간이 가까워졌다. 러시아에서 이러한 결정적인 시기를 살아가는 우리는 신속한 승리를 실현하기 위한 모든 군대의 긴밀한 단결과 조직이 바로 우리 인민들의 노력에 의한 성과라고 생각했다. 이러한 이유로 우리는 제국 의회와 합의하여 러시아 국가의 왕권을 포기하고 최고 권력을 내려놓는 것이 국가의 이익을 위한 것임을 인정했다. 차르 니콜라이 2세, 퇴위, 1917년 3월 15일 출처 2: “역사는 혁명가들이 오늘 승리할 수 있는데도(오늘 반드시 승리할 것임에도) 승리를 미루는 것을 용서하지 않을 것입니다. 그들은 내일 많은 것을 잃을 위험을, 사실 모든 것을 잃을 위험을 무릅쓰고 있습니다. 오늘 권력을 장악하면 이것은 소련 연방에 반하는 것이 아니라 혜택을 제공하는 것입니다. 권력 장악은 봉기의 임무인 것입니다. 장악 이후 우리의 정치적 목적은 분명해질 것입니다… 혁명의 구원, 평화의 제안, 페트로그라드의 구원, 기근으로부터의 구원, 농민에게로의 토지 양도가 그들의 손으로 일구어낼 수 있는 일이라는 것을 알고 있음에도 그 기회를 놓치는 것은 혁명가들의 입장에서는 무한한 범죄가 될 것입니다. 정부가 흔들리고 있습니다. 무슨 수를 써서라도 치명타를 날려야 할 때입니다. 블라디미르 일리치 레닌, 권력의 부름, 1917년 10월 24일","{'question': ""질문: 출처 2에서 블라디미르 일리치 레닌이 강조한 '새로운 권력 장악'의 필요성은 어떤 요인에 의해 촉발되었는가?"", 'choices': ['제국의 경제적 번영과 사회적 안정', '차르의 군사적 승리와 국민의 지지', '정부의 불안정과 농민의 고통', '외적의 침략과 군대의 승리', '정치적 개혁의 필요성과 국민의 요구'], 'answer': 3}",,단락에는 인디언들이 비좁고 위험한 작업 환경에서 곡괭이질을 하여 광석을 캐는 모습이 언급되어 있습니다. 이러한 작업 환경의 위험성은 그들이 겪고 있는 주요 문제 중 하나라고 할 수 있습니다.
generation-for-nlp-1319_aug,"폐하는 2개월마다 리마에서 60,000페소를 보내 인디언들의 미타 비용을 지불하셨습니다. 우아나벨리카 산맥에는 수은 광산에서 일하고 있는 3천에서 4천 명의 인디언들이 곡괭이와 망치를 들고 광석을 깨고 있습니다. 이러한 불쌍한 이들이 작은 자루를 채우면 사람이 오르내리기도 힘든 사다리와 삭구를 타고 이동했습니다. 이것이 이들의 작업 방식으로 밝은 빛과 두드리는 소리, 그리고 엄청난 혼란이 가득한 곳이었습니다. 그러나 이것이 가장 사악한 부분은 아닙니다. 진정한 사악은 바로 규율따위 없는 관리자들입니다. 폐하의 보증서에 따르면 포토시 광산의 주인은 13,300명의 인디언 미타 권리를 가지고 있습니다다. 미타 인디언들은 매일 4 헤알을 법니다. 이들 중에는 의무가 아니라 자발적으로 일하러 온 이들도 있습니다 .이들은 12에서 16 헤알을 받으며 24 헤알까지 받는 자도 있습니다. 얼마나 곡괭이질을 잘하는지에 따라, 또는 광물을 캐는 법을 잘 아는 경우입니다. 야쿠트족과 통구스족 원주민들이 멸망한 세 번째 주요한 이유는 이들이 처음 러시아의 지배 하에 놓였을 때부터 야사크 조공을 바치도록 한 것이다. 어떤 이들은 모피로, 어떤 이들은 여우로, 그것도 없는 이들은 돈으로 냈다. 북극해의 해변부터 레나 강 남부까지 처음엔 모피 동물이 많았지만 이제는 담비도 여우도 많이 남지 않았다. 게다가 반 이상의 원주민들은 이제 말이 없어 사냥을 하지 못하는데 대부분이 야사크 조공으로 빼앗겼기 때문이다.","{'question': '질문: 폐하의 미타 비용 지불 방식은 인디언들에게 어떤 영향을 미쳤는가?', 'choices': ['인디언들은 더 많은 돈을 벌게 되어 생활이 개선되었다.', '인디언들은 규율이 없는 관리자들로 인해 더욱 고통받았다.', '인디언들은 더 이상 광산에서 일하지 않게 되었다.', '인디언들은 자발적으로 일하는 비율이 증가하였다.', '인디언들은 노동 환경이 개선되어 효율적으로 일하게 되었다.'], 'answer': 2}",,"단락에서는 관리자의 규율이 없었던 점이 인디언들에게 고통을 주었다고 강조하고 있으며, 그들이 억압적인 상황 속에서 일해야 했음을 나타냅니다. 이런 불공정한 노동 환경은 인디언들의 삶에 부정적인 영향을 미쳤습니다."
generation-for-nlp-1320_aug,"몽골의 통치자인 칸들이 권력의 절정기에 방대한 영토를 확보함으로써 과거에 적대적이었던 민족들이 평화를 유지하고 사실상 모든 종교가 용인되었다… 징기스칸에 처음으로 공표한 법전에서는 인간의 상호작용을 명령했다. 그 결과로 국제 사회에 새로운 중요한 국면이 시작되었다. 동유럽에서 남중국까지 상인과 여행자들은 치안이 철저한 몽골 영지 내에서 생명이나 재산을 잃을 걱정 없이 이동할 수 있었다. 유럽, 아시아, 중동의 대부분을 장악하거나 연결하고 있던 방대한 몽골 영토는 동반구 문명을 잇는 다리 역할을 했다. 몽골 땅을 횡단한 상단과 사절단은 새로운 음식, 발명품, 사상을 한 문명권에서 다른 문명권으로 이동시켜 문명권 간의 중개자 역할을 했던 유목민들에게 전달했다. 안전한 무역 루트가 성공한 상인들과 부유한 대도시를 위해 구성되었다. 이들은 또한 음식[과] 발명품의 전파도 지원했다… 이는 경제 및 사회적 발전을 크게 가속시켰으며 문명화된 삶을 강화하게 되었다.","{'question': '질문: 몽골 제국이 교류한 다양한 문명들 사이에서 전파된 것 중 중요한 요소는 무엇인가?', 'choices': ['의학 기법', '도예 기술', '음식과 발명품', '음악 장르', '군사 전략'], 'answer': 3}",,몽골 제국은 동유럽에서 남중국까지 이어지는 방대한 영토를 통해 상인과 여행자들이 안전하게 이동할 수 있도록 하였습니다. 이 과정에서 서로 다른 문명 간에 새로운 음식과 발명품이 전파되어 경제 및 사회적 발전에 기여했습니다.
generation-for-nlp-1321_aug,"“따라서 위에서 언급한 카스티야, 레온, 아라곤, 시칠리, 그라나다 등의 왕과 여왕 및 대표자 그리고 위에서 언급한 포르투갈과 알가르베 등의 국왕은 다음과 같이 선언했다. [I.] 위 군주들과 구성원들 사이에 맺은 현 조약이 현재까지 바다에서 발견된 모든 땅이 상기된 부분에 각각 속하는지에 관해 논란이 있으므로 평화와 화합을 목적으로, 또한 포르투갈 국왕과 카스티야 아라곤 등의 국왕과 여왕 간의 관계와 사랑을 보존하기 위해 국왕 및 여왕들의 뜻에 따라 이들의 대리자들이 국왕과 여왕의 이름 및 여기 기술된 권한에 따라 북극부터 남극까지 위 언급된 바다의 남북으로 극에서 극까지 경계선 또는 직선을 결정하여 긋기로 언약하고 합의했다. 이 경계 또는 선은 위에 언급한대로 카보베르데 섬에서 서쪽으로 370리그 떨어진 곳에 직선으로 그어야 하며, 각도에 따라 계산하거나 가장 좋고 편리하다고 생각되는 방식으로 계산해야 하며, 거리가 위에 언급한 거리보다 길지 않아야 한다. 또한 위에 언급한 포르투갈의 국왕과 선박들이 앞서 언급한 경계선을 기준으로 남북과 무관하게 이쪽 및 동쪽에서 지금까지 발견한 섬과 본토를 포함한 모든 땅은 물론 앞으로 발견할 땅은 위 경계선을 넘지 않는 한 상기 포르투갈의 국왕과 그 후계자들에게 속하며 영구적으로 이들의 소유로 한다. 또한 위에서 결정된 경계선을 서쪽으로 통과한 후 남 북에 관계 없이 카스티야, 아라곤 등의 국왕과 여왕 및 이들의 선박이 이미 발견했거나 발견하게 될 섬과 본토를 포함한 모든 땅은 상기된 카스티야, 레온 등의 국왕 및 여왕과 그 후계자들에게 속하며 영구적으로 이들의 소유로 한다.”","{'question': '질문: 위 조약의 주요한 목적 중 하나는 무엇인가요?', 'choices': ['두 나라 간의 군사 동맹 체결', '상업 항로에 대한 독점 권리 확보', '양국 간의 평화 및 화합 유지', '새로운 무역 상품 개발', '전쟁을 통한 영토 확장'], 'answer': 3}",,"위의 단락에서는 포르투갈 국왕과 카스티야, 아라곤 등의 국왕과 여왕 간의 관계와 사랑을 보존하기 위해 평화와 화합을 목적으로 조약을 체결하였음을 강조하고 있습니다."
generation-for-nlp-1322_aug,"중세의 이론가 중에는 지하드가 방어 전쟁이라고 주장하는 사람도 일부 있었으나… 대부분의 권위자들은 전 세계가 이슬람의 지배권에 들어오기 전까지는 지하드의 의무가 계속되었다는 데 의견을 같이 했다. 바르(Barh) [1150년대 혹은 1160년대에 쓰여진 알파이드 혹은 ‘귀중한 덕의 바다’]에 따르면 무슬림 지도자의 첫 번째 의무는 지하드를 추진해 이슬람의 승리를 가져오는 것이다. 만일 그가 그렇게 하지 않고 이교도와 화해한다면 그 지도자는 세상을 타락시키는 것이므로 차라리 죽는 편이 더 낫다. 로버트 어윈, “이슬람과 십자군전쟁,” 1995 레바논 산 근처의 그리스도인들이 무슬림 은둔자를 보면 음식을 가져다 주고 친절하게 대하면서 이들은 위대하고 영광스러운 신에 헌신하는 자들이니 그들과 무엇이든 나눠야 한다고 말하는 것이 이상하다. 마찬가지로 무슬림 영토를 지나가던 그리스도교 상인이 붙잡히거나 방해받는 경우는 단 한 건도 없었다. 이븐 주바이르, 무슬림 학자, 메카와 예루살렘으로 이동 중, 1185년","{'question': '질문: 중세 이슬람 사회에서 지하드의 개념이 어떻게 해석되었으며, 이는 외부 세계와의 관계에 어떤 영향을 미쳤는가?', 'choices': ['무슬림 지도자의 의무로서 지하드는 전쟁과 공격성의 정당화를 의미했다.', '지하드는 중세 이슬람 사회 내에서 내적인 평화와 형제를 강화하는 역할을 했다.', '외부 세계와의 무역과 상업적 교류는 지하드의 의무와 관련이 없었다.', '지하드는 이교도와의 화해를 통해 이슬람 교리를 약화시키는 수단으로 여겨졌다.', '이슬람 지도자는 지하드의 필요성을 전혀 느끼지 못했으며, 평화적 관계 유지에 집중했다.'], 'answer': 2}",,"이슬람의 지하드는 단순한 군사적 무장을 넘어서, 무슬림 공동체 내에서의 단결과 평화를 강조하는 중요한 개념으로 여겨졌습니다. 이슬람 지도자가 전쟁 대신 화해를 선택하는 것이 타락이라고 주장했던 것처럼, 지하드는 외부 세계와의 관계에서도 상호 존중과 협력을 기반으로 작용할 수 있는 토대를 마련했습니다. 이러한 해석은 중세 이슬람 사회가 외부와 연결되는 방식을 이해하는 데 중요한 시각을 제공합니다."
generation-for-nlp-1323_aug,"“이 시기 북부 인도에서 개별 국가의 존재는 대개 그저 말에 불과했다. 무굴에 세금을 내는 자민다르는 분명 종속적인 위치에 있었으며, 주권을 주장하고 싶을 경우 첫 번째 단계는 세금 납부를 거부하거나 내지 않는 것이었다. 하지만 그렇게 세금을 내지 않는 것은 여러 다른 원인이 있을 수 있으며, 라즈푸타나나 중앙 인도, 초타나그푸르에는 법률가들이 이례적이라고 간주할 만한 위치에 있는 족장과 부족이 무수히 많았다. 이들은 정해진 세금을 내기도 하지만 때로는 대놓고 저항하기도 하고, 무굴 당국이 강압 조치를 시행하는 게 불편하다고 판단해 사실상 독립 상태를 영위하기도 했다.","{'question': '질문: 북부 인도의 자민다르와 족장들이 세금 납부에 있어 보이는 행동 양식은 무엇을 나타내는가?', 'choices': ['자민다르와 족장들은 항상 무굴 당국에 순종했다.', '중앙 정부의 영향력이 모든 지역에 동일하게 미쳤다.', '일부 지역의 세금 납부가 불편할 경우 자민다르와 족장들은 저항할 수 있었다.', '족장은 법률에 따라 항상 세금을 납부해야 했다.', '무굴 제국은 모든 부족의 독립을 허용했다.'], 'answer': 3}",,단락에서는 북부 인도에서 자민다르와 족장들이 세금을 납부하는 것 외에도 강압 조치에 저항하는 등의 행동을 통해 상대적으로 자율성을 유지하고 있다는 점이 강조되고 있습니다. 이는 지역적 특성과 권력의 분배가 세금 징수와 관련되어 다양하게 나타날 수 있음을 시사합니다.
generation-for-nlp-1324_aug,"우리는 또한 우리의 감각으로 사방에서 그분을 선포하며 가장 그 중 고귀한 감각인 시각을 통해 수행합니다. 말을 귀가 듣듯 이미지는 기억을 형성합니다. 글을 읽을 줄 아는 사람에게 책과 같은 것이 바로 글을 읽을 줄 모르는 사람에게의 이미지입니다. 이미지는 귀에 들리는 말처럼 시각에 전달됩니다. 이를 통해 우리는 세상을 이해하는 것입니다.
다마스커스의 요한, 하나님 성상을 반대하는 사람들에 대항한 변증, 기원전 730년 경
짧게 고해성사를 해 보자면, 우리는 글이나 구두로 우리에게 전해 내려온 모든 교회의 전통을 변함없이 유지하며, 그 중 하나는 그림으로 복음 전파의 역사에 부합하는 표현을 하는 것입니다. 다양한 부분에서 존중을 받은 이 전통은 특히 하나님의 말씀의 성육신은 단지 환상이 아니라 실제적인 것이라는 점으로 나타납니다. 왜냐하면 이것들은 상호 지시를 갖고 있으며 의심할 바 없이 상호 의미도 있기 때문입니다.","{'question': '질문: 이 단락에서 언급된 이미지의 역할에 대해 가장 잘 설명하는 선택지는 무엇인가?', 'choices': ['이미지는 신성에 대한 직접적인 경험을 제공한다.', '이미지는 문자적 해석 없이 중요한 교훈을 전달한다.', '이미지는 세상에 대한 이해를 심화시키는 도구로 기능한다.', '이미지는 종교적 교리의 핵심을 설명하는 데 불필요하다.', '이미지는 단순한 감상용으로서만 사용된다.'], 'answer': 3}",,"단락에서는 이미지를 통해 우리가 세상을 이해하고, 글을 읽지 못하는 이들에게도 복음을 전파할 수 있다는 점을 강조하고 있습니다. 이러한 내용은 이미지가 감각적으로 전달되는 방식과 우리 인지에 미치는 영향을 설명하고 있습니다."
generation-for-nlp-1325_aug,"린 쩌쉬, 중국 무역 대표, 빅토리아 여왕에게 보낸 편지, 1839. 그렇다면 어떤 논리에 따라 이 외국인들은 보답으로 독약을 보내는 것인가? 이들이 마음속에 그런 사악한 의도를 품고 있다는 건 아니나 이들의 부에 대한 욕심으로 인해 우리에게 입히는 피해에 대해 전혀 신경 쓰지 않고 있다는 사실을 분명히 주장하는 바이다! 그렇다면 우리는 하늘이 모든 인간에게 심어주신 양심은 어디에 있는지 묻고 싶다. 당신의 나라에서도 아편은 철저하게 금지되어 있다고 들었다. 이는 아편이 인류에게 얼마나 해로운지 당신도 잘 알고 있다는 강력한 증거다. 당신의 나라에 해를 끼치지 않도록 금지한 약물이라면 이 해로운 약이 다른 나라로 넘어가게 두어서도 아니되며, 그 무엇보다 내륙으로 들어가게 해서는 안된다! 중국에서 수출하는 물건 중에 인류에게 어떠한 형태로든 유익하지 않은 물건은 없다.","{'question': '질문: 린 쩌쉬의 편지에서 강조하는 주된 문제는 무엇인가?', 'choices': ['아편 거래의 윤리적 문제', '중국의 경제적 발전', '서구 문화의 전파', '외국 군대의 중국 침략', '무역의 불평등 조건'], 'answer': 1}",,"이 편지는 아편이 인류에게 미치는 해악과 그 거래가 중국 사회에 초래하는 피해를 지적하며, 이로 인해 생기는 도덕적 문제에 대한 강한 반대를 담고 있습니다. 린 쩌쉬는 아편의 해로움을 인식하고 있음에도 불구하고, 외국인들이 아편 거래를 통해 얻으려는 부에 대한 탐욕을 강조하고 있습니다."
generation-for-nlp-1326_aug,"“알 자와위는 또한 '이 술탄 무사가 ZKRY라는 마을에 구리 광산을 소유하고 있다고 했는데, 그곳에서 BYTY로 구리괴를 가져온다고 했다’고 했다. “무사는 가져오는 이 조악한 구리 외에는 세금을 낼 것이 내 왕국엔 아무 것도 없다고 말했다. 세금은 구리에만 내고 있다. 우리는 구리를 이교도 수단 땅으로 보내 무게의 2/3에 해당하는 금을 받고 판다, 100조각을 주고 66과 2/3의 금을 받는다.’고 했다. 그는 또한 자신의 왕국에 이교도 민족들이 있는데 이들에게는 조공(지즈야)을 받지 않고 이들을 고용해 금광에서 금을 뽑아내고 있다고 했다. 금은 사람 키 높이 정도로 구멍을 파 캐고 있으며 구덩이 옆이나 구덩이 바닥에 파묻혀 있는 것을 발견한다.” N. 레브치온과 J.F.P. 홉킨스 편집 서아프리카 역사를 위한 초기 아랍어 자료 모음. 케임브리지 대학교 출판부, 1981. 케임브리지 대학교 출판부의 허가를 받아 재인쇄. 알 우마리, 약 1300년–1384년","{'question': '질문: 다음 중 알 자와위의 설명에서 금광에서의 채굴 방식에 대한 정확한 설명은 무엇인가?', 'choices': ['금은 수작업으로 수확되며 구멍이 파인 참조로만 얻어진다.', '금은 전문 기계로 채굴되며 깊은 땅속에서 주로 발견된다.', '이교도 민족들이 직접 금을 채굴하는 방식으로 작용하며 규제가 없다.', '금은 주로 대량으로 채굴되지만 트럭을 이용해 운반된다.', '금은 이슬람 상인들과의 무역에 사용되기 위해 채굴된다.'], 'answer': 3}",,"문서는 이교도 민족들이 금광에서 금을 채굴하는 방식을 강조하며, 그들이 조공을 받지 않고 고용되어 활동하고 있음을 명시하고 있습니다."
generation-for-nlp-1327_aug,"오 믿는 자들아! 독한 술과 운수에 맡긴 게임과 우상은…사악한 사탄의 소행일 뿐. 성공하고 싶다면 그것들을 멀리하라. 코란, 수라 5: 89 장미가 꽃을 피웠다는 소식을 들으면 내 사랑, 그때가 와인을 부을 때입니다. 오마르 하이얌의 루바이야트","{'question': '질문: 이 단락에서 언급된 요소들이 성공에 미치는 영향에 대한 주장은 어떤 신념 체계에 기반하고 있는가?', 'choices': ['기독교의 금욕적 생활 방식을 강조하는 신념', '이슬람의 도덕적 가르침과 경계', '불교의 명상적 접근 방식', '유대교의 전통과 현대적 해석', '힌두교의 카르마 원리에 대한 믿음'], 'answer': 2}",,"단락은 이슬람 교리의 관점에서 독한 술, 운수에 맡긴 게임, 그리고 우상을 사악한 것으로 간주하며, 이러한 요소들을 멀리하라는 주장을 통해 성공을 위한 도덕적 접근 방식을 설명하고 있습니다. 이는 이슬람의 도덕적 가치관을 반영한 것입니다."
generation-for-nlp-1328_aug,"사티 관행의 존폐 여부를 결정하는 일은 끔찍한 책임감과 동일한 관련이 있습니다. 이를 막을 수 있는 힘이 있는데도 불구하고, 수백 명의 무고한 희생자들을 매년 잔혹하고 너무 이른 죽음에 방치하는 것은 양심이 있는 인간이라면 공포를 느끼지 않을 수 없는 잔혹 행위입니다. 반면, 인도에 주둔한 영국 제국의 안전을 위험에 빠뜨리는 일은 훨씬 더 큰 악행으로 간주될 수 있습니다. 우리에게 강력한 이웃이 있었고 우리의 안보를 의심할 만한 더 큰 위협이 있었을 때라면 보다 신중하게 진행하도록 했겠지만, 우리가 가장 우위를 점하고 있는 현재, 저는 공개적이고 전면적인 금지 조치에 찬성합니다. William Bentinck, 인도 총독, ""사티 억압에 관하여,"" 1829 나는 [우리와 거래하는] 인디언들의 본성과 성격을 조사하는 일을 연구로 삼았으며, 그것이 우리의 감정에 아무리 불쾌하더라도 나는 그들이 적절한 종속 상태에 있도록 하기 위해 철장으로 다스려야 한다고 확신합니다. 그리고 이를 달성하는 가장 확실한 방법은 그들이 [우리가 판매하는 식료품과 제조품]에 대한 의존성을 느끼게 하는 것입니다. George Simpson, 허드슨 베이 회사 북부 부서장, 1826년","{'question': '질문: 사티 관행을 억압하기 위한 공개적이고 전면적인 금지 조치에 대한 찬성 이유는 무엇인가?', 'choices': ['영국 제국의 이익을 유지하기 위해', '무고한 희생자를 보호하기 위해', '인디언들과의 관계를 강화하기 위해', '정치적 안정성을 이루기 위해', '종교적인 이유에서'], 'answer': 2}",,"단락에서는 사티 관행이 잔혹하고 무고한 희생을 초래하며, 이를 방치하는 것은 양심이 있는 인간에게는 공포를 안기고, 따라서 이러한 행위를 막기 위한 조치에 찬성하는 관점을 제시하고 있습니다."
generation-for-nlp-1329_aug,"“역사는 혁명가들이 오늘 승리할 수 있는데도(오늘 반드시 승리할 것임에도) 승리를 미루는 것을 용서하지 않을 것입니다. 그들은 내일 많은 것을 잃을 위험을, 사실 모든 것을 잃을 위험을 무릅쓰고 있습니다.
오늘 권력을 장악하면 이것은 소련 연방에 반하는 것이 아니라 혜택을 제공하는 것입니다. 권력 장악은 봉기의 임무인 것입니다. 장악 이후 우리의 정치적 목적은 분명해질 것입니다…
혁명의 구원, 평화의 제안, 페트로그라드의 구원, 기근으로부터의 구원, 농민에게로의 토지 양도가 그들의 손으로 일구어낼 수 있는 일이라는 것을 알고 있음에도 그 기회를 놓치는 것은 혁명가들의 입장에서는 무한한 범죄가 될 것입니다.
정부가 흔들리고 있습니다. 무슨 수를 써서라도 치명타를 날려야 할 때입니다.
블라디미르 일리치 레닌, 권력의 부름, 1917년 10월 24일","{'question': '질문: 레닌이 권력 장악을 강조하며 혁명가들에게 경고한 주된 이유는 무엇인가?', 'choices': ['자본주의 체제의 유지', '농민의 권리 증진', '미래의 불확실성에 대한 우려', '외부 세력의 개입', '혁명 실패의 역사적 반복'], 'answer': 3}",,"레닌은 혁명가들이 오늘 권력을 장악하지 않으면 미래에 많은 것을 잃게 될 위험이 있다는 점을 강조하며, 현재의 기회를 놓치는 것이 장기적으로 치명적인 결과를 초래할 수 있음을 경고했습니다."
