id,paragraph,problems,question_plus,hint
generation-for-nlp-1271_aug,"“마하트마 간디의 메시지입니다. 비폭력으로 남으십시오 이하는 발타이르에서 마하트마 간디가 보낸 메시지입니다. 마울라나 모하메드 AH는 발타이르에서 제 107조와 108조법에 의해 구금되어 1년 동안 감시를 받으며 올바른 행실을 유지하라는 명령을 받았습니다. 재판 기일과 장소는 정해지지 않았습니다. 베굼 사헤바와 하야트 씨는 체포 후에 모하메드를 면회했습니다. 저는 그와 함께 역 밖에서 회의를 할 계획이었습니다. 그랬는데 체포되었죠. 저는 그대로 회의에 참석해 참가자들에게 말했습니다. 슬퍼할 필요 없습니다, 이는 모두 축하할 일입니다. 동맹 휴업은 없어야 합니다. 완벽한 평화와 평온을 유지해야 합니다. 저는 우리가 비폭력을 고수할 수 있다면 이번 체포가 스와라지 사건과 칼리파트와 펀잡의 잘못을 바로잡기 위한 전조라고 생각합니다. 일부 모플라들이 광기를 띄고 있지만 우리는 힌두교와 무슬림의 통합을 유지하고 스와데시 프로그램을 완수해야 합니다. 저는 남녀를 막론하고 모든 인도인이 외국산 옷감을 거부하고 남는 시간에 방직에 힘쓰길 바랍니다. 마울라나처럼 분투해 종교와 국가적 권리를 주장하십시오. 감옥에 갈 이유를 만드십시오. 저는 마울라나가 무죄라는 사실을 알고 있으며 무고한 사람을 감옥에 보낸다면 우리 나라가 원하는 목표를 달성할 수 있다고 확신합니다.” 모한다스 간디, 순례자의 행진, 1921","{'question': ""질문: 마하트마 간디가 강조한 '비폭력'의 원칙이 인도 독립운동에 미친 영향은 무엇인가요?"", 'choices': ['인도 내에서 종교적 갈등을 심화시켰다.', '외국 제품의 철수를 유도하여 경제적 자립을 강화하였다.', '인도와 영국의 관계를 더욱 악화시켰다.', '대규모 폭력 사태를 유발하였다.', '독립운동에 대한 국제사회의 관심을 감소시켰다.'], 'answer': 2}",,마하트마 간디는 인도 독립운동의 일환으로 비폭력을 고수하며 외국산 제품의 거부와 자급자족을 강조했습니다. 이러한 비폭력 철학은 인도의 경제적 자립을 도모하고 독립운동에 대한 민족주의적 열망을 고취시켰습니다.
generation-for-nlp-1272_aug,"“신식민주의에 대항하는 투쟁은 선진국의 자본이 개발도상국에서 활동하는 것을 배제하는 것을 목적으로 두지 않습니다. 투쟁의 목적은 선진국의 자본력이 개발도상국을 가난하게 만드는 방식으로 사용되지 못하도록 하는 것입니다. 가나를 비롯한 많은 국가들이 실행하고 있는 비동맹주의는 자본주의, 사회주의 또는 혼합 경제주의 국가인지 여부와 무관하게 모든 국가와의 협력을 기반으로 합니다. 따라서 이러한 정책은 자본주의 국가들의 해외 투자가 필요하지만 비동맹 국가가 자국의 이익을 고려하여 그린 국가 계획에 따라 투자되어야만 합니다. 문제는 외국의 투자자들이 투자로부터 무엇을 얻을 지가 아닙니다…누가 힘을 가지고 있느냐 입니다. 신식민주의의 손아귀에 있는 국가는 자신의 운명을 스스로 정할 수 없습니다.”","{'question': '질문: 신식민주의에 대항하는 투쟁의 주된 목표는 무엇인가요?', 'choices': ['선진국의 자본이 개발도상국에서 완전히 철수하도록 하는 것', '개발도상국의 경제를 자립적으로 발전시키기 위해 자원 배분을 최적화하는 것', '선진국의 자본력이 개발도상국을 더욱 가난하게 만드는 것을 방지하는 것', '모든 국가가 자본주의 체제를 따르도록 강요하는 것', '비동맹 국가들이 선진국의 간섭을 받지 않도록 하는 것'], 'answer': 3}",,"단락에서는 신식민주의에 대항하는 투쟁은 개발도상국이 가난해지는 것을 막기 위한 것이며, 선진국의 자본이 그 지역에서 제대로 활용될 수 있도록 한다고 설명하고 있습니다. 이를 통해 자국의 이익을 고려한 투자가 이루어져야 함을 강조합니다."
generation-for-nlp-1274_aug,"“전하, 게다가 우리들의 왕국에는 신께 도움이 되지 않는 불편함이 존재합니다. 바로 우리 백성들 중 많은 이들이 그대의 백성들이 가져오는 왕국의 상품과 물건을 간절히 원하고 있다는 것, 그런데 그대의 백성들은 자신들의 탐욕스러운 욕망을 만족시키기 위해 자유민이자 해방된 나의 백성들을 잡아가고 있다는 것입니다. 심지어 귀족과 왕의 친척까지도 잡아가 우리들의 왕국에 있는 백인들에게 팔고 있다는 것입니다.” 콩고의 아폰소 1세 국왕이 포르투갈의 주앙 3세 국왕에게 보낸 편지, 1526 “이번 원정에 많은 비용이 들었기에 빈 손으로 돌아간다면 합리적이지 못한 일이 될 것이다. 우리의 [주된] 바람은 신을 섬기는 것과 콩고 국왕을 기쁘게 하는 것이지만, 그럼에도 불구하고 콩고 국왕으로 하여금 노예가 됐건 구리가 됐건 상아가 됐건 배를 채워야 한다는 사실을 우리들의 이름으로 이해시켜야만 한다.” 포르투갈 마누엘 국왕의 콩고에 있는 사절에게 보낸 편지, 1512","{'question': '질문: 아폰소 1세가 포르투갈의 왕에게 편지를 보낸 이유로 가장 적절한 것은 무엇인가?', 'choices': ['콩고 왕국의 군사력 증대', '콩고 왕국과 포르투갈 간의 무역 협정 체결', '콩고 백성의 고통과 식민적 착취에 대한 항의', '포르투갈 왕이 콩고에 대한 군사 원정 계획', '콩고 왕국의 문화와 전통을 알리기 위한 노력'], 'answer': 3}",,"아폰소 1세는 편지에서 자신의 백성들이 포르투갈 식민 세력에 의해 불공정하게 다뤄지고 있음을 언급하며, 그로 인해 생긴 불편함을 강조하고 있습니다. 이는 그가 왕국의 존엄성과 백성의 권리를 보호하고자 하는 마음을 잘 드러냅니다."
generation-for-nlp-1275_aug,"베네수엘라 주권 의회는 뉴 그라나다 공화국 국민의 자발적인 지지에 따라 그에 따른 권한을 지닙니다. 고려 사항: 1. “단일 공화국으로 통일된 베네수엘라와 뉴 그라나다의 각 지역은 모두 보다 높은 단계의 권력과 번영으로 나아갈 수 있는 모든 규모와 방법을 갖추고 있습니다. 2. “별도의 공화국을 구성한다고 해도 지역들이 더 강력하게 하나로 묶인다면 이들은 이점을 활용하지 못하고 주권을 존중하고 통합하기 힘들어질 것입니다. 3. “이러한 진실은 뛰어난 재능을 지닌 사람들과 깨어난 애국심에 의해 깊이 침투되어 양 공화국의 정부를 움직여 재결합을 꾀하도록 했으며 전쟁의 우여곡절을 통해 다음과 같은 콜롬비다 공화국의 헌법을 선언하도록 했습니다. 제1조. 베네수엘라 공화국과 뉴 그라나다 공화국은 오늘부터 콜롬비아 공화국이라는 영광스러운 명칭으로 하나의 공화국으로 통합된다… 제4조. 공화국의 행정권은 대통령에게 부여되며, 대통령이 궐위된 경우에는 부통령과 그의 대체자가 임시 의회에서 임명된다. 시몬 볼리바르가 소집한 앙고스투라 의회에서 통과된 그랑 콜롬비아 건국 헌법, 1819 출처 2: “성부와 성자와 성령의 이름으로. 제1편 - 브라질 제국의 영토와 정부와 왕조와 종교에 대하여. 제1조. 브라질 제국은 브라질 국민들의 정치결사체이다. 정치 결사체를 통해 자유롭고 독립적인 국가를 구성할 것이며 독립을 위협할 수 있는 기타 연합이나 연방을 구성하지 않을 것이다. 제2조. 제국의 영토는 현대와 같은 형태로 여러 주로 분할되며 국가의 이익에 따라 추가로 세분될 수 있다. 제3조. 정부는 세습군주제, 입헌군주제, 대표제 정부이다. 제4조. 현 왕조는 브라질의 현 황제이자 영원한 수호자인 돔 페드로 1세의 왕조이다. 제5조. 제국의 종교는 계속해서 가톨릭 사도 로마 종교이다. 다른 모든 종교의 숭배자들은 가정에서 또는 사원 외부에 다른 종교임을 나타내는 표식이 없는 한 특정 장소에서 예배를 드릴 수 있다.” 브라질 제국 헌법, 1824년 3월","{'question': '질문: 그랑 콜롬비아의 헌법이 통과된 앙고스투라 의회의 주요한 목적은 무엇이었나요?', 'choices': ['베네수엘라의 독립 선언', '브라질 제국의 재편성', '베네수엘라와 뉴 그라나다의 통합', '가톨릭 교회의 권위 강화', '민족주의 운동의 촉진'], 'answer': 3}",,"그랑 콜롬비아 헌법은 베네수엘라와 뉴 그라나다가 하나의 공화국으로 통합되기 위한 법적 기반을 마련하기 위해 제정되었습니다. 이는 양국 간의 협력과 통합을 강조하며, 당시의 정치적 상황에서 큰 의의를 지니고 있었습니다."
generation-for-nlp-1276_aug,"우리를 효과적인 힘으로 하나로 모아 우리 스스로 발전을 이룩하고 세계 평화에 가치 있는 공헌을 할 수 있게 하는 것은 단결 뿐이지 않겠습니까? 아프리카의 독립 국가 중 어느 나라가 자국의 금융 구조와 은행 기관이 자국의 발전에 전적으로 이용된다고 주장할 수 있습니까? 어느 나라가 자국의 물적 자원과 인적 에너지를 오롯이 자국의 열망을 위해 사용한다고 할 수 있습니까? 우리는 정치적 독립만으로는 식민 지배의 결과로부터 벗어나는 데 충분하지 않다는 것을 빠르게 깨닫고 있습니다. 우리는 각자의 분단된 나라들을 돌보는 데에 너무 바빠 공통된 목적, 공통된 계획과 공통된 노력에 근거한 기본적인 연합의 필요성을 이해하지 못했습니다. 콰메 은크루마 가나 대통령, 아프리카 통일 기구 연설, 1963","{'question': '질문: 단락의 내용에 따르면 아프리카 국가들이 발전을 이루기 위해 가장 중요한 요소는 무엇인가요?', 'choices': ['정치적 독립', '군사적 통합', '인적 자원의 활용', '경제적 협력', '외부 자원의 지원'], 'answer': 4}",,단락은 아프리카 국가들이 외부 세력의 영향에서 벗어나 자국의 발전을 위해 공통된 목표와 계획에 기반한 협력이 필요하다고 강조하고 있습니다. 이는 경제적 통합과 협력이 정치적 독립만으로는 해결되지 않는 문제임을 시사합니다.
generation-for-nlp-1278_aug,"“우리는 유럽인이 아닌 인도인입니다. 그러나 우리는 스페인과 원주민의 혼혈입니다. 태어난 곳은 아메리카지만 법적으로는 유럽인인 우리는 양면의 문제를 마주하고 있습니다. 소유권을 두고는 원주민들과 다투는 동시에 침략자들의 반대에 맞서 우리를 낳아준 나라에서 스스로를 지키기 위해 싸우고 있습니다. 그렇기에 우리의 입장이 가장 특이하고 복잡한 것입니다. 이 뿐만이 아닙니다. 우리의 역할이 항상 엄격하게 수동적이고 정치적인 존재감이 없었기에 항상 자유를 위한 우리의 여정이 지금에 이르러서는 더욱 얻기 어려워졌다는 것입니다. 우리는 노예보다 낮은 위치에서 자유 뿐만 아니라 국내의 독재에 저항할 권리마저 빼앗겼습니다…힘보다 기만에 의해 더 많이 지배당했고 미신보다 악행에 의해 더 모욕당했습니다. 노예제는 어둠의 딸입니다. 무지한 사람은 스스로를 파괴하는 맹목적인 도구에 불과합니다. 야망과 음모는 정치, 경제, 시민 사회적 지식이 모두 없는 사람들의 신뢰와 경험을 악용합니다. 이들은 순수한 환상을 현실처럼 받아들입니다. 자유 대신 허가를, 애국심 대신 배신을, 정의 대신 복수를 택합니다. 만일 집착적인 훈련으로 자유를 얻는 데에 성공하더라도 사람들은 곧 자유를 잃게 될 것입니다. 행복이란 미덕을 실천하는 데에 있다는 사실을, 법은 유연하지 않으므로 모두가 법에 따라 자비로운 엄격함에 복종해야 하기 때문에 법은 독재자보다 강력하다는 사실을, 올바른 도덕은 법의 기반이지 강제가 아님을, 정의를 실천하는 것은 자유를 실천하기 위함임을 설명해도 소용이 없을 것이기 때문입니다.","{'question': ""질문: 위 글에서 저자가 강조하는 '행복의 실천'과 관련된 주장은 무엇인가요?"", 'choices': ['자유를 위해서는 무조건적인 저항이 필요하다.', '법은 개인의 자유를 제한하는 것이기 때문에 무시해야 한다.', '진정한 행복은 도덕적인 행동을 통해 얻어진다.', '정치적 권리를 회복하기 위해서는 폭력이 필요하다.', '사람들은 기만과 환상으로부터 해방될 수 없다.'], 'answer': 3}",,"단락에서는 행복이란 미덕을 실천하는 데에 있다는 주장을 하고 있으며, 이는 도덕적 가치와 법의 중요성을 강조하는 내용과 밀접한 관련이 있습니다. 저자는 단순히 개인의 자유를 주장하는 것이 아니라, 정의와 도덕을 실천함으로써 참된 행복을 이룰 수 있다고 설명하고 있습니다."
generation-for-nlp-1280_aug,"“중국인들은 하등하다: 이들은 우상을 숭배하고 [힌두교]처럼 죽은 자를 화장한다. 중국의 왕은 타타르족이며 [징기스]칸의 후손 중 하나다… 중국의 모든 지역에는 [무슬림]을 위한 마을이 있고 이들은 거기에 거주한다. 또한 수도원, 대학, 모스크가 있으며 대부분 중국의 왕들에 의해 건설되었다.
우리가 [항저우 시]에 도착했을 때 지도자인 이슬람의 [장로]와 대상인들을 만났다. 그 곳은 [무슬림]이 매우 많았다. 도시 전체가 벽으로 둘러싸여 있으며 항저우의 [각 여섯 개 구역] 또한 벽으로 둘러쳐저 있다. 첫 번째 거주구에는 경비병과 지휘관이 거주한다. 듣기로는 등록부엔 12,000명이 있다고 하며 두 번째 구역에는 유대인, 그리스도교와 태양을 숭배하는 투르크족이 있다고 한다. 이들의 수는 많으며 정확한 수는 알 수 없다. 이들이 사는 구역이 가장 아름다운 도시다. 이들의 거리는 잘 정돈되어 있으며 상류층은 매우 부유하다. 도시에는 많은 [무슬림]들이 있었고, 나는 그들 중 일부와 보름 동안 함께 머물렀으며, 매우 [훌륭한] 대우를 받았다…""","{'question': '질문: 단락에서 언급된 항저우 시의 특징 중 어떤 요소가 당시의 경제적, 문화적 다원성을 보여줍니까?', 'choices': ['도시가 벽으로 둘러싸여 있음', '다양한 종교 공동체의 존재', '상류층의 부유함', '지역 관리의 이슬람 지도자', '12,000명의 등록된 주민 수'], 'answer': 2}",,"발췌문에서는 항저우 시에 다양한 종교와 민족이 공존하고 있다는 점이 강조되고 있습니다. 이슬람, 유대교, 그리스도교, 태양 숭배자들이 함께 살고 있는 모습은 당시 사회의 다문화적인 특성을 잘 보여줍니다."
generation-for-nlp-1281_aug,"“아프리카가 세계 평화에 기여할 수 있는 가장 큰 방법은 정치적 연합을 구성해 내부 분열에 내재되어 있는 모든 위험을 피하고 성공적인 연합 구성을 통해 분열된 세계에 모범을 보이는 것입니다. 아프리카 국가들의 연합은 아프리카의 특성을 보다 효과적으로 대표할 것입니다. 이를 통해 크기와 영향력만을 중요시하는 세계에서 존경을 받을 것입니다. 세계 각국은 사하라 사막에서 프랑스가 실시한 원자 폭탄 실험에 대한 아프리카의 반대에 거의 관심을 주지 않았으며, 콩고 공화국이 무정부 상태로 혼란스러운 와중에 콩고에서 유엔이 헌법적 미묘함을 두고 이의를 제기하는 불명예스러운 광경은 열강들이 아프리카의 독립성을 완전히 무시한다는 증거입니다.""","{'question': '질문: 아프리카의 정치적 연합이 세계에서 존경받는 이유는 무엇인가요?', 'choices': ['아프리카 국가들은 모두 자원을 풍부하게 보유하고 있다.', '아프리카 대륙은 자연재해가 적어 안전한 지역으로 여겨진다.', '아프리카 국가들이 일관된 외교 정책을 갖추게 된다.', '아프리카의 독립성과 통합된 목소리가 국제적 영향력을 강화한다.', '아프리카는 이미 세계 평화에 기여한 사례가 많다.'], 'answer': 4}",,"아프리카의 정치적 연합은 내부 분열을 극복함으로써 공동의 힘을 발휘하고 국제 사회에서 존경받는 위치를 차지할 수 있도록 하기 때문입니다. 이는 아프리카가 외부 세력의 간섭 없이 자율적인 결정을 내릴 수 있게 하며, 국제적으로도 신뢰를 구축하는 데 도움이 됩니다."
generation-for-nlp-1282_aug,"1897년 -1955년 러시아 제국 후기와 소련의 러시아어 사용 인구의 문해율
문해율
1897 24%
1917 45%
1926 56%
1937 75%
1939 81.10%
1955 99.90%
본문: 인구조사 자료와 소련 교육부","{'question': '질문: 19세기 말부터 20세기 중반까지 소련에서 문해율이 급격히 증가한 주된 원인은 무엇으로 볼 수 있을까요?', 'choices': ['경제 성장으로 인한 고용 증가', '교육에 대한 국가의 투자와 정책적 노력이 강화됨', '해외 교육 시스템의 도입 및 개혁', '군대의 문해 교육 프로그램 확대', '문화 혁명으로 인한 문학의 인기 증가'], 'answer': 2}",,"단락에서는 소련 정권 아래에서 교육의 중요성이 강조되었고, 문해율이 급격히 상승한 것은 국가의 교육 정책과 공교육 시스템의 개선 덕분이라고 언급하고 있습니다. 1917년 러시아 혁명 이후, 교육은 공산주의 이념 실현의 중요한 수단으로 여겨졌습니다."
generation-for-nlp-1283_aug,"""그들은 도착하자마자, 주요 관리들이 모두 모인 곳에서 위대한 칸으로부터 명예롭고 은혜로운 영접을 받았다. 이들은 가까이 다가가 평복하며 경의를 표했다. 칸은 이들에게 일어나라 하고, 여행에서 일어난 모든 일과 교황 성하와의 협상의 결과에 대해 보고하라고 했다. 이들은 사건 순서대로 명확한 언어로 이야기를 했으며 칸은 침묵하며 경청했다. 그레고리 교황에게서 온 편지가 칸의 앞에 놓였고 칸은 낭독을 들으며 사절단의 충성심과 열정, 근면함을 칭찬했다. 그리고는 성묘에서 나온 성유를 합당한 경의를 표하며 종교적인 성의를 다해 보존하라고 지시했다. 칸은 마르코 폴로를 보고는 누구냐고 물었고, 니콜로가 대답했다. 이 자는 폐하의 하인이자 내 아들입니다. 그러자 칸은 “그를 환영하며 나는 아주 기쁘다”고 대답하며 명예 수행원에 포함시켰다. 그리고 이들의 귀환에 맞춰 큰 잔치를 열어 축하했으며 형제들과 마르코가 칸의 궁정에 머무르는 동안 위대한 칸의 신하들보다 더 높은 대접을 받았다. 마르코 폴로는 궁정의 모든 이들로부터 높은 기대와 존경을 받았다. 마르코는 단기간 안에 타타르족의 관습을 익히고 네 가지 서로 다른 언어를 습득했으며 글을 읽고 쓸 수 있게 되었다.""","{'question': '질문: 마르코 폴로가 칸의 궁정에서 인정받은 이유는 무엇인가요?', 'choices': ['그가 새로운 종교를 전파했기 때문이다.', '그가 정치적 협상에 성공했기 때문이다.', '그가 다양한 언어를 습득하고 문화에 대한 이해를 높였기 때문이다.', '그가 다른 여행자들과 함께 대사를 이루었기 때문이다.', '그가 군사 작전에 참여했기 때문이다.'], 'answer': 3}",,마르코 폴로는 짧은 시간 내에 타타르족의 관습을 배웠고 네 가지 언어를 습득하여 글을 읽고 쓸 수 있게 되었다. 이러한 그의 적응력과 외교적 능력은 칸의 궁정에서 높은 기대와 존경을 받는 원인이 되었습니다.
generation-for-nlp-1284_aug,"“우리는 유럽인이 아닌 인도인입니다. 그러나 우리는 스페인과 원주민의 혼혈입니다. 태어난 곳은 아메리카지만 법적으로는 유럽인인 우리는 양면의 문제를 마주하고 있습니다. 소유권을 두고는 원주민들과 다투는 동시에 침략자들의 반대에 맞서 우리를 낳아준 나라에서 스스로를 지키기 위해 싸우고 있습니다. 그렇기에 우리의 입장이 가장 특이하고 복잡한 것입니다. 이 뿐만이 아닙니다. 우리의 역할이 항상 엄격하게 수동적이고 정치적인 존재감이 없었기에 항상 자유를 위한 우리의 여정이 지금에 이르러서는 더욱 얻기 어려워졌다는 것입니다. 우리는 노예보다 낮은 위치에서 자유 뿐만 아니라 국내의 독재에 저항할 권리마저 빼앗겼습니다…힘보다 기만에 의해 더 많이 지배당했고 미신보다 악행에 의해 더 모욕당했습니다. 노예제는 어둠의 딸입니다. 무지한 사람은 스스로를 파괴하는 맹목적인 도구에 불과합니다. 야망과 음모는 정치, 경제, 시민 사회적 지식이 모두 없는 사람들의 신뢰와 경험을 악용합니다. 이들은 순수한 환상을 현실처럼 받아들입니다. 자유 대신 허가를, 애국심 대신 배신을, 정의 대신 복수를 택합니다. 만일 집착적인 훈련으로 자유를 얻는 데에 성공하더라도 사람들은 곧 자유를 잃게 될 것입니다. 행복이란 미덕을 실천하는 데에 있다는 사실을, 법은 유연하지 않으므로 모두가 법에 따라 자비로운 엄격함에 복종해야 하기 때문에 법은 독재자보다 강력하다는 사실을, 올바른 도덕은 법의 기반이지 강제가 아님을, 정의를 실천하는 것은 자유를 실천하기 위함임을 설명해도 소용이 없을 것이기 때문입니다.","{'question': ""질문: 위 글에서 저자가 언급한 '자유를 위한 여정'의 주요 장애물은 무엇인가요?"", 'choices': ['외부적인 침략과의 갈등', '자체적인 정치적 무관심', '법과 제도의 유연성 부족', '경제적 불평등', '국제사회의 무관심'], 'answer': 2}",,"저자는 자신들의 위치와 정체성을 고민하며, 정치적 참여가 부족하고 이로 인해 자유와 권리를 잃어가는 여정을 강조하고 있습니다. 이러한 문제들은 정체성과 관련된 내부적 요인이라고 할 수 있습니다."
