id,paragraph,problems,question_plus,hint
generation-for-nlp-547,"아래의 두 발췌문은 각각 탐험가 크리스토퍼 콜럼버스와 멕시코 치아파스의 도미니카 주교 바톨로뮤 데 라스 카사스가 쓴 것입니다.
본문 1
인디언들은 판매자가 요구하는 것을 모두 주었습니다… 그리하여 그들은 바보처럼 목화와 금을 내어주고 부러진 활이나 유리 조각, 병 조각 등을 대가로 받았는데 나는 이러한 교환이 부당하다고 여겨 금지했고 나 스스로는 올 때 가져온 아름답고 흐뭇한 많은 물건들을 아무런 대가 없이 그냥 주었습니다. 내가 이렇게 한 것은 그들을 좀 더 우리 편으로 만들고, 기독교인이 될 수 있도록 인도하고, 왕과 왕비와 왕자들 그리고 모든 스페인 사람들에 대한 존중을 키울 수 있게 하기 위함이었습니다. 또한 그들에게는 풍부한 것, 하지만 우리는 절실히 필요한 것들을 그들이 직접 나서서 모아 줄 수 있도록 유도하기 위함이었습니다.
—크리스토퍼 콜럼버스: 라파엘 산체스에게 보낸 편지, 1493년
본문 2
이 온화한 양들에게 달린 일이었다. . . 스페인인들은 눈을 맞춘 첫 날부터 마치 맹렬한 늑대 혹은 며칠을 굶은 사자와 호랑이처럼 달려들었다. 처음부터 구성된 행동 패턴은 오늘날까지 변하지 않고 있으며 스페인인들은 여전히 원주민들을 잘게 찢고 살해해 말못할 고통과 괴로움, 절망을 안겨주며 고문하고 괴롭히며 무자비하게 박해하는 일만 반복하고 있다. 때가 되면 우리는 이들이 고문을 위해 발명해 개량한 수 많은 독창적인 방법 중 일부를 설명할 것이지만 피해자의 숫자 만으로도 얼마나 이들의 고문 방식이 효과적이었는지 알 수 있다. 스페인인들이 처음 도착했을 때 히스파니올라 섬의 원주민 인구는 약 3백만이었으나 지금은 200명만 살아남았다. 이토록 많은 수의 사람들을 죽이고 파괴한 이유는 그리스도교인들의 궁극의 목적이 금을 획득해 빠른 시간 안에 부를 획득해 자신들이 저지른 짓에 비추어 볼 때 말도 안되는 지위에 오르기 위함이었다.
–바톨로뮤 데 라스 카사스: 인디스 파괴에 대한 간략한 설명, 1542년","{'question': '다음 중 카사스가 본문 2에서 비판하고자 하는 탐험의 모티브는 무엇입니까?', 'choices': ['원주민들을 기독교로 개종', '부의 축적', '개인적 영광', '새 친구 찾기'], 'answer': 2}",,"바톨로뮤 데 라스 카사스는 본문 2에서 스페인 정복자들이 원주민을 착취하고 학살하는 행위를 비판하고 있습니다. 그의 비판은 이들이 금과 부를 얻기 위해 폭력과 고문을 동원한 탐험의 모티브에 집중되어 있습니다. 16세기 초, 스페인의 식민지 확장은 아메리카 대륙의 원주민에게 심각한 재앙을 가져왔고, 카사스는 이를 반성하고 원주민의 인권을 옹호하기 위해 노력했습니다. 그는 또한 기독교의 가르침과 정복자들의 행동 간의 괴리를 지적하며, 당시 스페인의 식민지 팽창이 경제적 이익에 불과함을 강조했습니다."
generation-for-nlp-548,"친애하는 내 벗에게, 자연은 매우 잔인하군요. 운동 법칙이라는 것이 우리 세상에서 어떻게 이렇게 무서운 재앙을 방생시킬 수 있는 지 상상조차 하기 힘듭니다. 우리 친구들은 수십만 마리의 개미가 마치 한 번에 개미집에서 짓밟히듯이 이 중 절반이 말로 다 할 수 없는 고통 속에 빠져나올 수 없는 잔해에 깔려 있습니다. 유럽 전역에서 가족들이 파멸에 빠졌고 우리 동포인 수 백의 사업가들의 재산이 리스본의 잔해에 묻혀버렸습니다. 인생 게임이란 얼마나 끔찍한 도박입니까! 종교재판소 궁전이 아직 있다면 설교자들은 무어라 말할까요? 저는 적어도 존경하는 종교 재판관님들은 다른 이들과 마찬가지로 뭉게졌을 것이라고 스스로를 칭찬합니다. 사람은 서로를 박해하지 말라고 가르쳐야 합니다. 일부 성자를 칭하는 악당들이 광신도를 불태우는 동안 지구는 우리 모두를 집어 삼켜버릴테니까요.","{'question': '다음 계몽주의 철학자 중 이성에 대한 의존에 의문을 갖고 주어진 근거를 통해 낭만주의 운동을 시작한 사람은?', 'choices': ['장 자크 로쏘, 사회가 고귀한 영혼을 타락시켰다고 믿었다.', '바론 몽테스키외, 정부가 공정해질 능력이 없다고 믿었다.', '메리 울스턴크래프트, 여성의 감정적인 복속에 반대했다.', '아담 스미스, 타인의 감정을 이해하는 데에 이성을 사용할 수 없다고 주장했다.'], 'answer': 1}",,"지문의 내용은 1755년 리스본 대지진 이후의 사회적 충격을 반영합니다. 이 재앙은 인간의 이성에 대한 낭만적 의구심을 불러일으켰고, 그 대표적인 철학자는 임마누엘 칸트와 요한 고틀리프 피히테입니다. 이들은 계몽주의 이성 중심 사상에 의문을 품고 감정, 직관, 주관성을 중시하는 낭만주의로 이끌었습니다. 이 시기 유럽은 산업 혁명과 사회 변화로 인해 인간 존재의 의미를 탐구하는 열정이 넘쳐났습니다. 낭만주의는 이런 배경 속에서 각각의 개인적 경험과 감정을 중요시하게 반영되었습니다."
generation-for-nlp-550,"1651년 12월 1일 이후 아시아, 아프리카 또는 아메리카에서 성장, 생산 또는 제조되어 나온 어떠한 상품이나 상품, 또는 위에 속하는 섬에서 나온 상품, 또는 이들 지역의 통상적인 지도나 카드에 기술되어 있거나 표시된 상품, 영국 식민지와 다른 식민지에서 생산된 상품은 영연방이나 아일랜드 또는 해당 연방에 속하거나 연방이 소유하고 있는 다른 땅, 섬, 식민지 또는 영토로 수입하거나 반입할 수 없으며, 다른 선박 또는 운반선에 실어서는 아니된다. 그러나 해당 연방의 국민이나 식민지에 속한 소유자 또는 권리 보유자로서 진정으로 기만 없이 소속된 배의 경우에만 가능하다. 또한 이 법에 반하여 수입되는 모든 상품은 몰수 및 손실의 처벌을 받는다. 유럽 또는 유럽에 속하는 곳에서 생장, 생산 또는 제조된 상품이나 물품은 1651년 12월 1일 이후 영연방이나 해당 연방에 속하거나 소유하고 있는 다른 땅이나 영토로 어떠한 선박, 운반선 및 운반 수단을 통해 수입되거나 반입될 수 없다. 단,해당 연방의 국민이나 식민지에 속한 소유자 또는 권리 보유자에게 진정으로 기만 없이 소속된 함선 및 운반선의 경우에만 가능하다.","{'question': '위에 언급된 1651 항해법은 다음 중 어느 경제 철학자의 이론 및 신념에 반하고 있습니까?', 'choices': ['토마스 맬서스', '조시아 차일드', '애덤 스미스', '쟝 밥티스트 콜버트'], 'answer': 3}",,"1651년 항해법은 영국의 상업적 독점과 보호무역을 강화하기 위한 법률로, 아담 스미스의 자유시장 경제 이론에 반합니다. 스미스는 시장이 공급과 수요에 따라 운영되어야 하며, 정부의 간섭을 최소화해야 한다고 주장했습니다. 이 법은 국가의 상업적 이익을 위해 특정 상품의 수입과 수출을 제한했기 때문에, 자유무역과 경쟁의 원칙에 저해되는 것으로 볼 수 있습니다. 또한, 당시 영국은 식민지 확장을 통해 경제적 이익을 추구하고 있었고, 이는 유럽 식민지 경쟁의 일환으로 나타났습니다."
generation-for-nlp-551,"페레스트로이카[개혁]는 우리 사회주의 사회의 심오한 발전 과정에서 발생하는 긴급한 필요다. 이 사회는 변화의 시기가 무르익었다. 오랫동안 갈망해 왔다. 페레스트로이카 시작이 조금이라도 지연되면 가까운 장래 내부 상황이 악화될 수 있었고, 솔직히 말하면 심각한 사회, 경제, 정치적 위기를 겪게 되었으리라. 미하일 고르바초프, 페레스트로이카: 조국과 세계를 위한 신사고, 1987년","{'question': '다음 중 위 글로부터 추정할 수 있는 고르바초프의 주장은?', 'choices': ['소련 사회주의 사회의 재구성은 불가피했다.', '소련 사회주의 사회의 재구성은 현재 상황을 악화시킬 것이다.', '소련 사회주의 사회의 재구성은 위기를 피하기 위해 필요했다.', '소련 사회주의 사회의 재구성은 소련 붕괴를 막기 위해 필요했다.'], 'answer': 3}",,"고르바초프의 주장은 소련 사회의 구조가 심각한 변화와 개혁이 필요하다는 점을 강조합니다. 1980년대 소련은 경제적 비효율성과 정치적 억압으로 어려움을 겪고 있었고, 이는 동구권 국가들에도 영향을 미쳤습니다. 페레스트로이카는 경제 재구성과 글라스노스트(개방) 정책을 통해 사회 전반에 걸친 투명성을 목표로 하였으며, 이는 궁극적으로 냉전 종식과 동유럽 민주화의 촉진제가 되었습니다. 이러한 맥락에서 고르바초프는 개혁을 통해 위기를 예방하고 지속 가능한 발전을 추구하고자 했습니다."
generation-for-nlp-552,"이 순간부터 적이 공화국 땅에서 쫓겨나는 순간까지, 프랑스인 모두는 영구 징발되어 군에 복무한다. 젊은 남성은 전투에 나가야 한다. 기혼 남성은 무기와 운송수단을 제작해야 한다. 여자는 천막과 의복을 만들고 병원에서 봉사해야 한다. 아이들은 낡은 아마포를 보풀로 만들어야 한다. 노인들은 공공장소에 나와 전사의 용기를 일깨우고 왕들에 대한 증오와 공화국의 단결을 전파하여야 한다. … 공공안전위원회는 책임을 지고 프랑스 국민의 열정과 힘에 부응하는 모든 종류의 특별한 무기를 지체 없이 제조하기 위해 필요한 모든 조치를 취한다. 따라서 위원회는 이 작업 수행에 필요하다고 간주되어야 하는 모든 시설, 공장, 작업장, 공장을 설립하고 공화국 전 범위에서 성공에 기여할 수 있는 예술가와 작업자를 징발할 권한이 있다. 본법 집행을 위해 파견된 국민 대표는 각자의 지역에서 공공안전위원회와 협력 시 동일 권한을 갖고, 군대에 대한 국민 대표에게 부여된 무제한의 권한을 부여받는다. 국민개병, 1793년 8월 23일","{'question': '다음 중 위 글이 근대 유럽의 전쟁 역사에서 전환점을 대표한다고 할 수 있는 이유는?', 'choices': ['대규모 산업화로 생산된 무기의 도입을 의미하기 때문이다.', '국가의 적에 대한 완전 섬멸을 주장했다.', '위원회에 의해 진행된 전쟁이다.', '전면전을 옹호했다.'], 'answer': 4}",,"위 글은 1793년 프랑스 혁명 시기의 '국민개병법'을 언급하고 있으며, 이는 군사력의 근본적인 변화를 보여주고 있습니다. 전통적인 귀족 중심의 군대에서 국민 모두가 참여하는 대중 군대로의 전환을 나타냅니다. 이 법은 프랑스 혁명의 원칙인 자유, 평등, 박애를 체현하며, 특히 전시 국가의 역할을 강조하여 국민 전체가 전투 및 지원에 참여하게 하였습니다. 이러한 변화는 19세기 이후 유럽의 전쟁 양상에 큰 영향을 미쳤고, 국가와 시민 간의 관계에 혁신을 가져왔습니다. 이는 나폴레옹 전쟁 등에서 대규모로 징병하는 모델로 자리잡아 이후 유럽 전역으로 확산되었습니다."
generation-for-nlp-553,"조신의 주된 진짜 직업은 무력을 다루는 일이어야 한다고 생각한다. 나는 그가 무엇보다도 열성적으로 이를 따르기를 바라며 다른 이들 사이에서 대담하고 강하다고 알려지며 섬기는 자에게 충성하길 바란다… 나는 그가 균형 잡힌 사지에 다부진 몸을 지니고 힘과 가벼움과 유연성을 보였으면 하며 군인에게 맞는 모든 운동을 알고 있길 바란다. 생각할 수 있는 첫 번째는 지상에서 및 말을 타고 모든 종류의 무기를 다룰 줄 알아야 하는 것이며 각 무기의 장점을 이해하고 특히 신사들이 일반적으로 사용하는 무기를 잘 알아야 한다. 우리의 궁정인은 그렇게 높은 평가를 받고 모든 일, 특히 언변에서 은혜를 얻게 될 것이다. . . . 적어도 인문학이라는 학문 분야에서는 그럭저럭 성취할 수 있을 만한 성과를 거두길 바라며, 그 안에 기록된 훌륭한 내용과 더불어 라틴어는 물론 그리스어도 능통하기를 바란다. 그는 시에 정통해야 하며 연설가와 역사가에 대해서도 잘 알아야 하며 속된 말로 운문과 산문을 쓰는 데에도 능숙해야한다. 나는 궁정가가 음악가도 아니라면, 음표를 이해하고 읽는 것에 더해 다양한 악기를 연주할 줄 알아야 만족한다는 것을 아셔야 한다. . . . 나는 우리 궁정가가 거짓말쟁이나 허풍쟁이라는 오명을 받는 일이 없도록 경계하기를 바란다. 그런 일은 무고한 사람에게도 가끔 발생한다. —발다사레 카스티글리오네의 궁정론, 1528년","{'question': '다음 중 위 글과 가장 연관이 깊은 르네상스 시대의 테마는?', 'choices': ['세속주의', '개인주의', '인본주의', '관점'], 'answer': 3}",,"지문은 발다사레 카스티글리오네의 ""궁정론""에서 발췌된 것으로, 르네상스 시대의 인문주의와 기사도 정신을 반영합니다. 르네상스(14세기~17세기)는 고대 그리스와 로마의 문화 재발견과 인간 중심의 사고가 특징인 시기로, 궁정에서의 체계적 교육과 예술적 소양을 강조했습니다. 또한, 군사적 기술뿐 아니라 인문학적 소양, 특히 라틴어, 그리스어, 음악의 이해를 통해 문화적 신사의 이상을 드러내고 있습니다. 이는 마키아벨리의 정치적 이론과도 연결되어 당시 유럽의 권력 구조와 궁정 사회의 복잡성을 반영합니다."
generation-for-nlp-554,"혁명의 씨앗은 모든 국가에 침투하여 다소 퍼졌습니다. 씨앗은 보나파르트의 군사 독재 하에서 크게 발전했습니다. 나폴레옹의 정복은 수 많은 법률, 제도, 관습을 대체하며 모든 국가 간의 신성한 유대를 부쉈으며 시간 그 자체에 저항할만큼 강했습니다. 이는 혁명가들이 부여한 특전한 혜택이라고 말할 수 있는 것 그 이상입니다.
군주들은 의무를 부여한 자의 뜻에 따라 정의와 모든 사람들의 권리를 유지하고 오류로 가는 길을 피하고 진실의 길만을 따라가도록 자신에게 위임된 의무를 다할 것입니다. 사회를 뒤흔드는 열정 너머에 있는 그들은 주로 시련의 나날에 거짓 현실을 벗기고, 가장에게 당연히 속한 권위를 부여 받은 아버지로서, 애도의 날에도 정의롭고 현명하며 따라서 강할 줄 알고, 자신들이 다스려야 할 사람들을 파벌의 장난거리가 되도록 내버려두지 않을 것이며, 오류와 그 결과, 사회의 상실을 수반하지 않을 것임을 증명해야 합니다.
군주들 간의 연합은 완전한 파멸로부터 사회를 구하기 위해 지금 당장 추구해야 하는 정책의 기반입니다.
그들이 인정된 필요에 따라 행정의 특정 부서를 변경하도록 하여 당파에 대한 양보와 국민을 위해 해야 할 선행을 혼동하지 않도록 합시다.
군주들이 정의로우면서 강하고 자비로우면서 엄하길 바랍니다.
이들이 종교적인 원칙을 순수한 관점에서 따르고 신앙이 박해당하도록 두지 않으며 도덕이 사회적 합의나 어리석은 종파의 의견에 따라 해석되지 않도록 하게 합시다.
이들이 사회를 좀먹는 비밀 결사를 억압하도록 합시다.
—클레멘스 폰 메테르니히, 정치적 신앙고백, 1820","{'question': '위 문서에는 빈 회의 개최 중에 메테르니히가 이끈 협상의 최종 결과가 어떤 식으로 언급되고 있나요?', 'choices': ['메테르니히의 보나파르트의 군사적 전제주의에 대한 성명은 유럽의 모든 제국의 몰락으로 이어졌다.', '메테르니히의 의무 이행에 대한 발언은 유럽의 운명을 좌우하는 신성 동맹에 대한 그의 지지를 나타낸다.', '메테르니히의 군주 연합에 관한 발언은 유럽 협력체의 창설을 암시한다.', '메테르니히는 비밀 결사에 대한 혐오감을 느껴 칼스바트 법령을 제정하게 되었다.'], 'answer': 3}",,"메테르니히는 1815년 빈 회의에서 유럽의 정치 질서를 재편성하고 나폴레옹 전쟁 이후의 혼란을 극복하려 했습니다. 그의 협상이 가져온 결과는 '신(新)정치 전쟁'이라는 개념으로, 이를 통해 왕권과 보수주의를 강화하고 이를 통해 혁명적 위험을 억제하려 했습니다. 독재와 군주 간의 연합을 통해 사회를 안정시키는 것을 목표로 하였고, 이는 후에 유럽 각국 간의 균형 유지를 위한 제국적 협력으로 이어졌다."
generation-for-nlp-555,"정부가 빈곤층에 대한 구원투수의 직책을 맡는 일은 정부는 지키는 것 이상의 일을 할 수 없다는 원칙에 의해 필연적으로 금지된다. 국민에게 고통 완화를 위한 금전적 기여를 요구함으로써 정부는 그 기능이 역전되고 있다. 기본법을 집행해 모든 사람이 다른 사람의 평등한 자유를 침해하지 않는 한 원하는 바를 이룰 자유를 보장해야 한다. 하지만 이는 누군가의 만족을 보장하는 것과는 별도의 문제이다.
무능한 이의 가난, 섣부른 자의 곤경, 게으른 자의 굶주림과 강자에게 약자를 떠넘기는 일은 보다 크고 앞을 내다보는 자비에 의한 결정이다. 이를 분리해서 생각하지 않고 인류 공통의 이익과 연결지어 생각해 보면 이런 가혹한 운명도 커다란 은혜로 가득하다고 볼 수 있다.
허버트 스펜서, 사회적 통계: 인류에 적용되는 적자생존, 1851년","{'question': '다음 중 위 글에서 스펜서가 옹호한 19세기의 정치 철학은?', 'choices': ['보수주의', '무정부주의', '자유주의', '사회주의'], 'answer': 3}",,"허버트 스펜서가 옹호한 19세기 정치 철학은 사회 다윈주의입니다. 이는 자연선택의 원리를 사회에 적용하여, 개인의 경쟁과 자율성을 중시하며 정부의 간섭을 최소화해야 한다고 주장합니다. 19세기 유럽은 산업 혁명으로 인한 사회적 변화와 빈곤 문제에 직면했으며, 스펜서는 정부의 복지 개입을 반대했습니다. 그의 관점은 자본주의와 개인의 자유를 강조하는 계몽주의 사상과도 연결되며, 이러한 이론은 이후 사회복지 국가와의 대립을 통해 지속적인 논란을 일으켰습니다."
generation-for-nlp-556,"질문은 다음과 같은 정보를 포함합니다.
아래 불만 목록을 읽어보십시오.
제3조: 프랑스 국민은 국회에서 제정되어 왕이 승인한 법률만을 왕국의 법률로 인정해야 한다.
제11조: 개인의 자유, 재산권, 시민의 안전은 명확하고 정확하며 취소할 수 없는 방식으로 확립되어야 한다. 모든 비밀 체포 영장은 삼부회가 부과하는 것이 적절하다고 판단하는 특정 수정에 따라 영원히 폐지된다.
제12조: 프랑스인의 개인적 권리 및 재산권에 침해 가능성을 영구적으로 제거하고자 모든 형사사건과 민사사건의 사실 확인을 위해 왕국의 모든 법원에 배심원제를 도입한다.
제17조: 형벌의 모든 차별은 폐지되어야 한다. 다양한 계층의 시민이 저지른 범죄는 동일한 법률 형식과 동일한 방식으로 처벌된다. 삼부회는 범죄 결과가 해당 개인에게만 국한되고 전혀 참여하지 않아 무죄인 해당 범죄자의 친인척에게 연좌되지 않도록 해야 한다.
제21조: 국민 대표가 수락하고 국왕이 승인하지 않는 한 어떤 세금도 합법적이지 않다.
—베르사유 제3부 의사록, 1789년","{'question': '다음 중 위에서 언급된 프랑스 혁명의 원인이 된 문제점으로 올바르지 않은 것은?', 'choices': ['부채와 세수 감소로 인한 재정 문제.', '공평하지 않은 법 체계.', '계몽주의 이념의 확산.', '1789년 프랑스에 만연했던 사회 정치적 불평등.'], 'answer': 1}",,"지문은 1789년 프랑스 혁명과 관련된 제3부 의사록의 일부로, 당시 프랑스의 정치적 및 사회적 갈등을 반영합니다. 이 당시 프랑스는 구체제(Ancien Régime) 하에서 양반(귀족)과 성직자, 그리고 평민(제3신분) 간의 불평등한 세금 및 법적 대우에 의해 불만이 고조되었습니다. 이와 함께 계몽주의 사상가들(볼테르, 루소 등)의 영향을 받아 개인의 권리와 자유에 대한 요구가 증가했습니다. 이러한 배경은 절대 왕정에 대한 반발을 초래했으며, 결국 1789년 바스티유 감옥의 습격과 같은 사건을 통해 혁명으로 이어졌습니다. 여기에 특정 문제점이 혁명의 직접적인 원인이 아니라고 평가하는 것이 중요합니다."
generation-for-nlp-557,"1848년은 독일과 유럽 역사에 있어 결정적인 해로, 독일의 과거를 요약하고 독일의 미래에 영감을 주었다. … 사상의 힘에 대한 무한한 믿음에서 그토록 영감을 받은 혁명은 결코 없었고, 결과를 놓고 사상의 힘을 그토록 불신한 혁명도 없었다. 혁명의 성공은 보수 사상을 불신하게 만들었고, 혁명의 실패는 자유주의 사상을 불신하게 만들었다. 이후에는 힘이라는 개념 외에는 아무것도 남지 않았고, 이 개념은 그때부터 독일 역사의 중심이 되었다. 1521년 이후 처음으로 독일 국민은 독일 무대 중앙에 올라섰으나 또 한 번 신호를 놓쳤다. 독일의 역사는 전환점에 이르렀으나 전환하지 못했다. 이것이 1848년의 운명적 본질이었다. A. J. P. 테일러, 독일 역사 과정, 1945년","{'question': '다음 중 인용문에서 테일러가 1848년 정치 혁명이 끼친 가장 중요한 영향이라고 주장하는 것은?', 'choices': ['지배계급 변화에 실패', '사상의 힘을 보여줌', '보수주의와 자유주의 정치이념 모두에 대한 불신', '현대 경찰력의 개념 창조'], 'answer': 3}",,"1848년 유럽에서는 '민중 혁명'이 발생하며 여러 국가에서 자유와 민권을 요구하는 움직임이 일어났습니다. 특히 독일에서는 여러 도시에서 혁명이 일어났고, 이는 독일 통일 운동과 자유주의의 발전에 기여했습니다. A. J. P. 테일러가 언급한 것처럼, 이 해의 혁명은 사상의 힘에 대한 신뢰를 불러일으키기도 했지만, 동시에 보수 및 자유주의 사상에 대한 불신을 초래했습니다. 이러한 반전은 이후 독일 역사에서 힘의 개념이 중심이 되는 계기를 만들었습니다. 이 시기의 정치적 혼란은 나중에 독일의 국가 형성과 정치적 진화에 중요한 영향을 미쳤습니다."
generation-for-nlp-558,"애디슨 법은 전후 노동계급이 바라는 바가 신속하게 충족되지 않으면 영국도 러시아와 유사한 혁명을 경험할 수 있다는 믿음에서 고안되었다. 1920년에 이르러 두려움은 사라지기 시작했고 애디슨의 정책은 과도한 것으로 간주되었다. 새 태도의 즉각적인 희생자는 1920년 9월 승인된 임시 계획인 버러의 킹필드 스트리트 계획이었다. 정부의 주택위원회는 계획을 연기했으며 ""의회의 현 약속과 현 시점 이용가능한 자금을 고려하여 1921년 5월 정부는 주택 공급 프로그램을 대폭 축소하여 주택 목표를 반으로 삭감했다""고 발표하여 의회를 놀라게 했다.","{'question': '다음 중 위에서 변경된 계획을 가장 잘 설명한 것은 무엇입니까?', 'choices': ['1차 세계대전 이후 복지 프로그램에 대한 의문이 제기되었습니다.', '주택은 영국 예산의 큰 부분을 차지했습니다.', '노동자가 공산주의 혁명을 위협하고 있었습니다.', '정부 주택위원회는 주택을 더 많이 짓고자 했습니다.'], 'answer': 1}",,"지문에서 언급된 '애디슨 법'은 제1차 세계대전 후 영국의 사회 복지와 주택 문제 해결을 목표로 한 법안으로, 노동계급의 요구에 응답하기 위해 설계되었습니다. 이 시기는 사회적 불안정과 혁명적 움직임이 감지되던 때로, 러시아 혁명(1917) 이후 많은 유럽 국가들이 혁명의 위협을 느꼈습니다. 1920년대 초, 경제 불황과 하락세에 접어들면서 영국 정부는 재정적 부담을 줄이기 위해 주택 공급 프로그램을 축소하게 되었고, 이는 노동계급의 기대에 반하는 조치로 사회적 불만을 초래했습니다."
