id,paragraph,problems,question_plus,hint
generation-for-nlp-607,"이 권력의 목적과 척도는 자연 상태에서 각 개인의 손에 있을 때 그의 사회 전체, 즉 일반적으로 모든 인류의 보존이다. 그러므로 통치자의 손에 있을 때 이 권력의 목적과 척도는 그 사회 구성원들의 생명, 자유, 재산 보존 외에는 없기에 생명과 재물에 대한 절대적이고 자의적인 권력이 될 수 없다. 가능한 한 보존되어야 하나 법을 만들고 처벌을 더하여 전체를 보존하는 것을 목표하되 일부만을 제거함으로써 전체를 위협하는 부패한 일부만을 없앨 뿐이다. 그렇지 않으면 어떤 엄격함도 합법적이지 않다. 그리고 이 권력은 공동체 구성원의 협약, 동의, 상호 동의를 통해서만 근원을 갖는다. … 그러므로 언제든 입법부가 사회의 기본 규칙을 넘어서 야망, 두려움, 어리석음 또는 타락으로 자신이나 다른 누군가의 손에 사람들의 생명, 자유, 재산에 대한 절대 권력을 쥐려 하면, 신뢰의 파탄으로 사람들이 전혀 다른 목적으로 부여한 권력을 상실한다. 존 로크, 통치론, 1690년","{'question': '이 구절에 따르면 로크가 다음 사상의 옹호자였다고 주장할 수 있습니다.', 'choices': ['신권군주제', '전제주의', '입헌주의', '사회주의'], 'answer': 3}",,"존 로크는 통치론(1690)에서 사회계약론을 통해 개인의 생명, 자유, 재산의 보존을 강조하며, 권력이 사회 구성원의 동의에 기반해야 한다고 주장했습니다. 이는 계몽주의 시대의 핵심 사상으로, 당시 유럽은 절대왕정과 권위주의에 도전하는 새로운 사상가들이 등장하던 시기였습니다. 로크의 사상은 미국 독립선언서와 프랑스 혁명에 영향을 미쳤으며, 개인의 권리와 민주적 거버넌스의 기초가 되었습니다. 이러한 맥락 속에서 그를 현대 민주주의 및 인권 사상의 중요한 옹호자로 평가할 수 있습니다."
generation-for-nlp-608,"이 지문에 나타난 정보는 무엇입니까? 아래 발췌문을 읽어보십시오. 바울이 반복하여 이 타락이 죄라 하였다 . . . 간음, 음행, 도적질, 증오, 살인, 방탕 같은 죄의 열매를 성경 여러 구절에서 동일한 방식으로 표현한다. . . 우리는 단지 그러한 타락으로 옮음, 무죄, 순결 외에는 아무것도 받지 않으시는 하나님께 합당한 정죄를 받은 것이다. —장 칼뱅, 기독교 강요 제2권: 1장, 1545년 생명의 언약은 모든 사람에게 동등히 전도되지 않으며, 전도된 사람들 사이에서도 항상 동등히 받아들여지지 않습니다. 이 다양성은 신의 심판의 심오함을 나타내며 의심의 여지없이 영원한 택하심인 하나님의 목표에 종속됩니다. 그러나 구원이 누군가에게는 자발적으로 제공되는 것이 오직 하나님의 기쁨 때문인 경우, 세상에는 즉시 중요하고 어려운 문제가 발생하며, 특히 택하심과 운명 예정설에 대한 올바른 시각이 없으면 설명할 수 없다. . . 하나님의 은혜는 모든 사람을 무차별적으로 구원의 희망에 채택하지 않고 누구는 부여하고 누구는 거부함으로써 대조를 통해 명확히 드러난다. —장 칼뱅, 기독교 강요 제3권: 21장, 1545년","{'question': '칼뱅과 같은 프로테스탄트 개혁가들이 사용한 정당화 중 위에 언급된 것은 무엇입니까?', 'choices': ['교회가 국가에 종속되어서는 안 된다고 믿었습니다.', '로마 가톨릭 교회와 그 지도자들의 부패는 개혁이 필요함을 의미했습니다.', '지상 군주의 권위에 도전하는 데 종교가 사용되었습니다.', '구원은 선행이 아닌 믿음만으로 이루어진다는 개념이 뒷받침됩니다.'], 'answer': 2}",,"장 칼뱅은 16세기 프랑스 태생의 스위스 개혁가로, 종교 개혁의 중심 인물 중 하나입니다. 그의 주요 사상 중 하나는 예정설으로, 하나님이 구원할 대상을 미리 정해 놓았다고 주장했습니다. 이는 프로테스탄트 개혁가들이 강조한 '구원의 은혜는 인간의 노력과 무관하다'는 점과 연결됩니다. 16세기 유럽은 종교적 갈등으로 얼룩져 있었으며, 개신교와 가톨릭 간의 충돌은 30년 전쟁(1618-1648) 등으로 심화되었습니다. 칼뱅의 사상은 이후 개신교 신학적 방향성을 수립하는 데 중요한 기초가 되었습니다."
generation-for-nlp-611,"""1500년 에라스무스가 도버에서 불행을 겪고 집필하여 마운트조이에게 헌정한 작품인 아다기오룸 콜렉타네아(Adagiorum Collectanea)가 나타났다. 고대 라틴어 작가로부터 발췌한 약 800개의 속담 모음집으로, 라틴어를 우아하게 쓰기고자 하는 사람들이 사용할 수 있도록 설명되어 있다. 헌정 시 에라스무스는 자기 스타일을 꾸미고 논증을 강화함에 있어 고대부터 귀하게 여겨진 문장을 충분히 공급하여 얻을 수 있는 이득을 지적했다. 독자에게 그러한 도움을 주고자 했다. 실제로 준 도움은 그 이상이었다. 고대의 정신을 통해 이전 인문주의자가 도달했던 것보다 훨씬 더 넓은 범위도 잘 알게 되었다. 지금까지 인문주의자는 다수에게 여전히 부족한 지식을 자랑하고 배움과 우아함의 이상한 천재가 되고자 고전 문화의 보물을 다소 독점해 왔다. 막을 수 없는 가르침에 대한 요구와 인류와 일반 문화에 대한 진실한 사랑으로 에라스무스는 16세기 기독교인의 영혼에 반영될 수 있는 최대한의 고전 정신을 사람들에게 소개했다. 혼자 해낸 것은 아니나, 더 넓은 범위에 효과적으로 해낸 사람은 없다. 물론 라틴어로 저술함으로써 모든 사람에게 전파하지는 못했으며 당시 교육받은 상류층에만 직접적인 영향을 미쳤다. 에라스무스는 고전 정신을 현재로 가져왔다. 인본주의는 더는 소수의 전유물이 아니었다. 베아투스 르헤나누스에 따르면 그는 아다지아를 출판하려 할 때 일부 인본주의자들로부터 그들 기술의 신비를 폭로했다는 이유로 비난받았다. 그러나 그는 고전 책이 모든 이에게 공개되기를 원했다.""","{'question': '이 지문에 나타난 정보는 무엇입니까?', 'choices': ['그러한 특성을 중요히 여기는 20세기 유럽인으로서의 작가의 삶', '에라스무스의 작업이 오래 살아남은 것', '에라스무스의 작업에 대한 네덜란드인으로서의 존경심', '다른 철학자의 작업에 대한 한 철학자의 전형적인 확고한 지지'], 'answer': 1}",,"지문은 에라스무스의 인문주의적 작업, 특히 ""아다기오룸 콜렉타네아"" 출판과 관련된 내용을 다루고 있습니다. 16세기, 르네상스 시대는 고전 고대를 재조명하며 인문주의가 부각된 시기로, 에라스무스는 이를 통해 기존의 교육 체계를 개선하고자 했습니다. 그는 라틴어 작품을 통해 상류층의 지식 독점을 비판하고, 고전을 대중에게 보급하려 했습니다. 이 시기는 종교개혁과도 연관되어 있으며, 에라스무스의 접근은 이후 마르틴 루터의 개혁사상을 발전시키는 데 영향을 미쳤습니다. 고전 문화의 재발견은 또한 과학, 철학, 예술 분야의 발전으로 이어졌습니다."
generation-for-nlp-612,"이 권력의 목적과 척도는 자연 상태에서 각 개인의 손에 있을 때 그의 사회 전체, 즉 일반적으로 모든 인류의 보존이다. 그러므로 통치자의 손에 있을 때 이 권력의 목적과 척도는 그 사회 구성원들의 생명, 자유, 재산 보존 외에는 없기에 생명과 재물에 대한 절대적이고 자의적인 권력이 될 수 없다. 가능한 한 보존되어야 하나 법을 만들고 처벌을 더하여 전체를 보존하는 것을 목표하되 일부만을 제거함으로써 전체를 위협하는 부패한 일부만을 없앨 뿐이다. 그렇지 않으면 어떤 엄격함도 합법적이지 않다. 그리고 이 권력은 공동체 구성원의 협약, 동의, 상호 동의를 통해서만 근원을 갖는다. … 그러므로 언제든 입법부가 사회의 기본 규칙을 넘어서 야망, 두려움, 어리석음 또는 타락으로 자신이나 다른 누군가의 손에 사람들의 생명, 자유, 재산에 대한 절대 권력을 쥐려 하면, 신뢰의 파탄으로 사람들이 전혀 다른 목적으로 부여한 권력을 상실한다. 존 로크, 통치론, 1690년","{'question': '이 구절에서 로크가 사회와 그 합법적인 정부가 사회 구성원들에 대한 권력을 가질 수 있는 이유라 주장한 것으로 적절한 것을 고르십시오.', 'choices': ['신성한 권리', '해당 사회구성원의 동의', '사회구성원 간의 약속', '정복'], 'answer': 2}",,"존 로크는 17세기 영국의 경험론 철학자로, 그의 '통치론'은 민주주의와 정부의 정당성을 다룬 중요한 저작입니다. 로크는 사회 계약 이론을 주장하며, 정부의 권력은 시민의 동의와 협약에서 유래해야 한다고 강조했습니다. 이는 권위주의적 통치에 대한 반발로, 청교도 혁명(1642-1651)과 같은 정치적 격변을 배경으로 합니다. 그의 사상은 나중에 미국 독립 선언서 작성에 영향을 미친 민주적 원칙으로 자리잡았습니다. 로크의 주장은 시민 권리 보호와 정부의 책임을 정당화하는 근거로, 자유와 소유권의 보장을 핵심으로 합니다."
generation-for-nlp-613,"다음은 1889년 파리박람회에 대한 설명입니다. ""박람회 기간 동안, 특히 대의회와 프랑스 협회가 회의를 열었던 8월 파리에서 인류의 자연사를 연구할 기회는 인류학 역사상 유례없는 기회였다. 프랑스 수도는 언제든 인류학자에게 드문 이점을 제공한다. 브로카 박물관과 실험실, 팔레 드 쥐스티스에 있는 베르티옹의 인체측정 수술, 인류학 에꼴 강의 과정, 파리 식물원의 수집품, 의학 에꼴의 고유 작업 시설, 비교 해부학자와 생물학자에게 일자리를 풍부하게 제공하는 병원이 있다."" 오티스 T. 메이슨, 미국 민족학자 겸 큐레이터, 1889년","{'question': '파리박람회의 기록에 묘사된 과학자는 다음 중 어떤 과학 선구자의 영향을 받았을 가능성이 큽니까?', 'choices': ['아인슈타인', '플랑크', '노벨', '다윈'], 'answer': 4}",,"1889년 파리박람회는 당시 인류학과 생물학 발전의 중요한 전환점이었으며, 특히 프랑스의 과학자 아르망 피에르 뒤메릴이나 조르주 퀴비에와 같은 인물들의 이론적 기초에 영향을 받았을 가능성이 큽니다. 이들은 비교 해부학과 진화 이론을 발전시켰으며, 이 시기에 인류학자들이 그들의 연구를 심화하는 데 기여했습니다. 또한, 다윈의 진화론이 성행하면서 생물학적 다양성에 대한 관심이 높아지면서 인류학 연구가 과학적 방법론을 채택하게 되었습니다. 이러한 맥락에서, 파리박람회는 다양한 과학적 담론의 중심지로 기능했습니다."
generation-for-nlp-615,"다음은 블라디미르 I. 레닌의 연설에서 발췌한 것입니다. 국방을 위한 산업 기반이 충분하지 않으면 조국의 독립성은 유지될 수 없다. 그러한 산업 기반은 우리 산업이 기술적으로 더 발전하지 않으면 만들어질 수 없다. 바로 우리 산업의 빠른 발전 속도가 필요하며 필수인 이유다. 우리는 무기한으로, 다시 말해 지나치게 긴 시간 동안 소련 정권과 사회주의 건설을 서로 다른 두 기초인 최대 규모의 통일된 사회주의 산업의 기초와 가장 분산되고 낙후된 소규모 영세 농민 상품경제의 기초에 의존할 수 없다. 우리는 점차적이나 체계적이고 지속적으로 우리 농업을 새로운 기술적 기초인 대규모 생산의 기초 위에 놓고 사회주의 공업 수준으로 발전시켜야 한다. 우리가 이 임무를 완수하면 우리나라 사회주의의 최종 승리가 보장될 것이다. 우리가 임무에서 등을 돌리고 완수하지 않으면 자본주의로의 복귀가 불가피할 수 있다.","{'question': '레닌이 위 연설에서 수정해야 한다고 말한 신경제 정책의 타협안은 다음 중 무엇입니까?', 'choices': ['내전 이후 농촌 지역의 자유 시장과 타협', '임시정부와 권력 공유', '공산주의 강화를 위해 정부에 너무 많은 권한을 부여', '지원 대가로 농민을 지주로부터 해방'], 'answer': 1}",,"레닌의 연설에서는 소련의 산업화와 농업의 현대화 필요성이 강조됩니다. 이는 1921년 도입된 신경제정책(NEP)을 수정해야 한다는 맥락에서 이해할 수 있습니다. NEP는 경제 위기 극복을 위해 소규모 사유 농업을 허용하고 일부 시장 경제 원칙을 도입했습니다. 그러나 레닌은 이러한 타협안이 자본주의로 회귀할 위험이 있다고 경고하며, 대규모 사회주의 산업 기반의 필요성을 주장합니다. 따라서 이 연설은 NEP의 한계를 지적하고 보다 강력한 산업 중심의 사회주의 건설을 촉구하는 내용입니다."
generation-for-nlp-616,"다음 인용문은 1755년 리스본 지진에 대한 볼테르의 반응입니다. 친애하는 내 벗에게, 자연은 매우 잔인하군요. 운동 법칙이라는 것이 우리 세상에서 어떻게 이렇게 무서운 재앙을 발생시킬 수 있는지 상상조차 하기 힘듭니다. 우리 친구들은 수십만 마리의 개미가 마치 한 번에 개미집에서 짓밟히듯이 이 중 절반이 말로 다할 수 없는 고통 속에 빠져나올 수 없는 잔해에 깔려 있습니다. 유럽 전역에서 가족들이 파멸에 빠졌고 우리 동포인 수백 사업가들의 재산이 리스본의 잔해에 묻혀버렸습니다. 인생 게임이란 얼마나 끔찍한 도박입니까! 종교재판소 궁전이 아직 있다면 설교자들은 무어라 말할까요? 저는 적어도 존경하는 종교 재판관님들은 다른 이들과 마찬가지로 뭉게졌을 것이라고 스스로를 칭찬합니다. 사람은 서로를 박해하지 말라고 가르쳐야 합니다. 일부 성자를 칭하는 악당들이 광신도를 불태우는 동안 지구는 우리 모두를 집어 삼켜버릴테니까요.","{'question': '볼테르는 다음 중 어떤 계몽주의 철학의 요구를 지지하는 것으로 가장 잘 알려져 있습니까?', 'choices': ['모든 사람은 이신론을 유일한 논리적 종교로 받아들여야 합니다.', '종교적 관용은 사회 통합의 파괴로 이어집니다.', '회의주의는 믿음직한 정보 조사 방법이 아닙니다.', '모든 종교를 믿는 모두에게 종교적 관용이 주어져야 합니다.'], 'answer': 4}",,"볼테르는 18세기 유럽 계몽주의의 주요 철학자로, 이성, 비판적 사고, 종교적 관용을 중시했습니다. 리스본 지진에 대한 그의 반응은 자연재해에 대한 신의논증과 종교적 맹신을 도전하는 계몽주의의 요구를 반영하고 있습니다. 그는 종교 기관의 권위를 비판하고, 인간의 고통을 이해하는 데 있어 이성과 합리성의 필요성을 강조했습니다. 이는 18세기 프랑스 혁명, 인권 및 민주주의 사상과도 연결됩니다. 볼테르의 사상은 개인의 자유와 권리를 옹호하며, 사회적 불의에 대한 반발을 촉진했습니다."
generation-for-nlp-617,"이 지문에 나타난 정보는 무엇입니까? 아래 불만 목록을 읽어보십시오. 제3조: 프랑스 국민은 국회에서 제정되어 왕이 승인한 법률만을 왕국의 법률로 인정해야 한다. 제11조: 개인의 자유, 재산권, 시민의 안전은 명확하고 정확하며 취소할 수 없는 방식으로 확립되어야 한다. 모든 비밀 체포 영장은 삼부회가 부과하는 것이 적절하다고 판단하는 특정 수정에 따라 영원히 폐지된다. 제12조: 프랑스인의 개인적 권리 및 재산권에 침해 가능성을 영구적으로 제거하고자 모든 형사사건과 민사사건의 사실 확인을 위해 왕국의 모든 법원에 배심원제를 도입한다. 제17조: 형벌의 모든 차별은 폐지되어야 한다. 다양한 계층의 시민이 저지른 범죄는 동일한 법률 형식과 동일한 방식으로 처벌된다. 삼부회는 범죄 결과가 해당 개인에게만 국한되고 전혀 참여하지 않아 무죄인 해당 범죄자의 친인척에게 연좌되지 않도록 해야 한다. 제21조: 국민 대표가 수락하고 국왕이 승인하지 않는 한 어떤 세금도 합법적이지 않다. —베르사유 제3부 의사록, 1789년","{'question': '다음 중 프랑스 혁명으로 인한 변화 중 프랑스 농민들이 가장 찬성한 것은 무엇입니까?', 'choices': ['입헌군주제 창설', '봉건세와 지대 폐지', '대중의 정치 참여 증가', '종교 국유화'], 'answer': 2}",,"지문의 내용은 프랑스 혁명 초기의 '인권 선언' 및 법률 체계의 변화에 대한 것으로, 1789년 제3회의 의사록에서 발췌한 것입니다. 이 시기는 프랑스 혁명으로 사회 구조가 급격히 변화하던 때로, 농민들은 세금과 지주에 대한 억압을 해소하고 공정한 법 적용을 원했습니다. 특히 배심원제의 도입과 차별 없는 법 적용은 농민들이 지지한 변화의 핵심으로, 신분에 따른 차별을 완전히 폐지하고 사회적 정의를 실현하려는 혁명의 목표와 일치합니다."
generation-for-nlp-618,"이 지문에 나타난 정보는 무엇입니까? 다음 정부 보고서를 읽어보십시오. 주민들이 치료하지 못한 환자 450명 중 200명이 밖으로 나왔고 우리는 이들이 길가에 쓰러져 하나씩 죽어가는 것을 보았다. 아직도 죽어가는 사람이 많아, 각자에게 빵을 최소한만 나눠줄 수 있다. 빵이 없으면 죽을 사람들에게만 주고 있다. 이곳 주식은 주민들이 사냥하는 쥐로 만든 것이라 배고픔에 매우 절망한다. 이들은 동물도 못 먹는 뿌리를 먹는다. 사실 우리가 보는 것을 말로 표현할 수 없다. . . . 이 이야기는 과장이 아니라 사건의 공포를 과소평가한 것인데, 이 구의 비참함을 100분의 1도 기록하지 못하였기 때문이다. 직접 눈으로 보지 않으면 규모가 얼마나 컸는지 짐작조차 할 수 없다. 하루도 채 지나지 않아 두 지방에서 최소 200명이 기근으로 사망했다. 우리는 소떼가 아니라 남녀 라임스와 레텔 사이의 들판을 돌아다니며 뿌리 몇 조각을 찾으러 돼지처럼 땅을 뒤덮는 모습을 목격했음을 증언한다. 썩은 뿌리만을 찾은데다 그중 절반은 아무것도 찾지 못해 너무 약해져서 음식을 찾을 힘도 남아있지 않다. 우리가 편지를 동봉한 볼트 교구의 신부는 굶주림으로 죽은 교구민 셋을 매장했다고 했다. 나머지는 잘게 썰어 흙과 섞은 짚으로 빵이라고 부를 수 없는 음식을 만들어 연명한다. 같은 곳의 다른 이들은 질병으로 죽은 동물 시체를 먹고 살았는데, 다른 방법으로는 사람들을 도울 수 없었던 신부가 장로회의 벽난로에 굽는 것을 허했다.","{'question': '다음 중 17세기 프랑스 국민이 직면한 건강과 기아 문제에 가장 적게 기여한 것은 무엇입니까?', 'choices': ['생산성 낮은 농업 관행', '악천후', '농민과 중산층의 낮은 세금', '열악한 교통'], 'answer': 3}",,"지문은 17세기 프랑스의 기근 상황과 그로 인한 건강 문제를 다루고 있습니다. 이 시기는 프랑스의 절대왕정 하에서 기근과 전염병이 만연하던 시기로, 특히 1630년대와 40년대의 기후 변화와 전쟁(삼십년전쟁 등)이 농업 생산성에 큰 타격을 주었습니다. 또한, 사회적 불만과 혁명적 움직임이 커지던 시기로, 리볼리 시위와 같은 사건이 있었습니다. 식량 부족은 주민들이 사냥한 쥐로부터 생존을 위협받는 상황을 초래했으며, 이는 정치적 무능과 경제적 불안과 밀접한 관련이 있습니다."
generation-for-nlp-619,"백인의 짐을 떠맡아라—
최고의 품종을 보내어라—
가서 네 아들들을 묶어 유배시켜
포로들의 필요를 충족하여라
무거운 밧줄에 묶여 기다려라
설렌 사람들과 야만인—
그대의 새로 붙잡힌 음침한 민족들
반은 악마이고 반은 아이인 자들 위에서.
...
백인의 짐을 떠맡아라—
잔혹한 평화의 전쟁—
기근의 입을 가득 채우라
질병이 멈추도록 명하라
목표가 가장 가까워올 때
다른 이들이 추구하는 종말이란…
나태와 이방인의 어리석음을 경계하라
모든 희망을 없애노라
러디야드 키플링, 백인의 짐, 1899년
키플링은 최근 미국-스페인 전쟁에서 스페인을 상대로 승리한 미국의 필리핀 식민지화라는 주제를 다루고자 백인의 짐을 썼다는 점이 일반적으로 인정됩니다. 이 정보를 염두에 두고 발췌문에서 키플링이 미국인에게 제공하는 메시지는 무엇이라고 말할 수 있습니까?","{'question': '키플링이 미국인에게 제공하는 메시지는 무엇이라고 말할 수 있습니까?', 'choices': ['현대 문명의 혜택을 저개발 민족에게 전할 선진 문명의 책임 상기', '제국주의의 전쟁과 어려움을 피하라는 경고', '세계의 이방인 민족을 기독교화하라는 요청', '제국주의의 순전한 어리석음을 역설적으로 표현'], 'answer': 1}",,"러디야드 키플링의 ""백인의 짐""은 제국주의와 인종 우월주의의 맥락에서 쓰여졌으며, 미국인에게 식민지 확장의 책임과 의무를 강조하는 메시지를 담고 있습니다. 19세기 후반, 유럽의 여러 국가들이 아프리카와 아시아를 식민지화하며 자기 문명을 '보급'한다는 주장을 정당화했습니다. 미국의 필리핀 식민지는 이러한 태도를 반영하며, 키플링은 미국이 제국주의적 역할을 충실히 수행하라고 촉구하고 있습니다. 이는 당시 사회의 제국주의적 열망과 함께, 식민지에서의 '문명화' 사상의 일환으로 이해될 수 있습니다."
generation-for-nlp-620,"기밀—귀하의 개인정보 및 지침 오스트리아-헝가리 대사는 어제 오스트리아-헝가리의 관점에서 현황을 묘사하며 빈이 고려하는 조치가 담긴 프란츠 요제프 [오스트리아-헝가리] 황제의 기밀 개인 편지를 [독일] 황제[빌헬름 2세]에게 전달했습니다. 이제 사본을 귀하에게 전달합니다. … 폐하께서는 러시아와 세르비아의 범슬라브 동요의 결과로 오스트리아-헝가리, 나아가 삼국동맹을 위협하는 위험을 눈여겨 보고 계신다고 말씀드리고 싶습니다. ... 이에 더해 폐하께서는 프란츠 요제프 황제의 뜻에 따라 카롤 왕을 움직여 부쿠레슈티의 동맹 의무를 이행하고, 세르비아를 포기하고, 오스트리아-헝가리에 대한 루마니아의 선동을 진압하도록 노력하실 것입니다. 마지막으로 세르비아에 관한 한 폐하께서는 오스트리아-헝가리와 세르비아 간 현 진행 중인 분쟁에 개입하실 수 없습니다. 폐하의 권한 밖의 문제이기 때문입니다. 그러나 프란츠 요제프 황제는 동맹 의무와 오랜 우호에 따라 오스트리아-헝가리의 편에 설 것임을 확신할 수 있습니다.","{'question': '베트만홀베크의 전보 내용을 가장 잘 설명한 것을 고르십시오.', 'choices': ['독일 통일 과정에서 독일과 오스트리아-헝가리의 협력', '발칸 문제와 삼국동맹', '독일의 파리조약 위반과 재무장', '독일이 오스트리아-헝가리, 이탈리아와 삼국동맹을 결성하기 위한 협상'], 'answer': 2}",,"이 지문은 제1차 세계대전 발발 전의 오스트리아-헝가리와 독일 간의 외교적 긴장을 보여줍니다. 당시 유럽은 삼국동맹(독일, 오스트리아-헝가리, 이탈리아)과 삼국협상(영국, 프랑스, 러시아)이라는 두 진영 간의 복잡한 외교관계 속에 있었고, 세르비아의 범슬라브 운동은 오스트리아-헝가리의 내부 문제를 자극했습니다. 또한, 러시아는 슬라브 민족의 보호자 역할을 주장하며 개입할 가능성이 있었죠. 이러한 외교적 압박 상황 속에서 오스트리아-헝가리는 프란츠 요제프 황제가 내린 강경한 입장을 바탕으로 세르비아에 대한 견제를 강화했습니다. 이 전보는 이러한 동맹과 국제 관계의 복잡성을 잘 나타내고 있습니다."
